case,location,date,summary,fatalities,injured,total_victims,location,age_of_shooter,prior_signs_mental_health_issues,mental_health_details,legal_weapon,where_obtained,weapon_type,weapon_details,race,gender,sources,mental_health_sources,sources_additional_age,latitude,longitude,type,year,Place,,State,Hist_Unemp_St,,Fatality Status
Sandy Hook Elementary massacre,"Newtown, Connecticut",41257,"Adam Lanza, 20, shot his mother dead at their home then drove to Sandy Hook Elementary school. He forced his way inside and opened fire, killing 20 children and six adults before committing suicide.",27,2,29,School,20,Yes,"Lanza had a history of serious mental health problems that were known to his family and others, as detailed in a post-massacre investigation by Connecticut authorities.",No,Stolen from mother,"Two semiautomatic handguns, one rifle (assault), one shotgun (assault)","10mm Glock, 9mm SIG Sauer P226 semiautomatic handguns; .223 Bushmaster XM15-E2S semiautomatic rifle; Izhmash Saiga-12 12-gauge semiautomatic shotgun",white,Male,http://usnews.nbcnews.com/_news/2012/12/14/15911025-authorities-id-gunman-who-killed-27-in-elementary-school-massacre?lite; http://articles.washingtonpost.com/2012-12-14/local/35846977_1_law-enforcement-lanza-brothers-kid,http://usnews.nbcnews.com/_news/2012/12/14/15911025-authorities-id-gunman-who-killed-27-in-elementary-school-massacre?lite; http://articles.washingtonpost.com/2012-12-14/local/35846977_1_law-enforcement-lanza-brothers-kid,http://usnews.nbcnews.com/_news/2012/12/14/15911025-authorities-id-gunman-who-killed-27-in-elementary-school-massacre?lite; http://articles.washingtonpost.com/2012-12-14/local/35846977_1_law-enforcement-lanza-brothers-kid,41.4123225,-73.31142358,Mass,2012,"Newtown, Connecticut",11,Connecticut,Low Unemployment,,More Fatalities
Accent Signage Systems shooting,"Minneapolis, Minnesota",41179,"Andrew Engeldinger, 36, upon learning he was being fired, went on a shooting rampage, killing the business owner, three fellow employees, and a UPS driver. He then killed himself.",7,1,8,Workplace,36,Yes,"His family worried about his ""paranoia and delusions"" for at least two years prior, and tried to get him to seek treatment.",Yes,Unknown,One semiautomatic handgun,9mm Glock semiautomatic handgun,white,Male,http://www.startribune.com/local/171774461.html?refer=y,http://www.startribune.com/local/171774461.html?refer=y,http://www.startribune.com/local/171774461.html?refer=y,44.977425,-93.310408,Mass,2012,"Minneapolis, Minnesota",9,Minnesota,Low Unemployment,,Low Fatalities
Sikh temple shooting,"Oak Creek, Wisconsin",41126,"U.S. Army veteran Wade Michael Page, 40, opened fire in a Sikh gurdwara before he died from a self-inflicted gunshot would during a shootout with police.",7,3,10,Religious,40,Yes,"His Army friends once broke into his apartment, fearing he'd commit suicide in the '90s. A psychiatric nurse who lived downstairs from Page said it was ""obvious"" he had a mental illness.",Yes,Unknown,One semiautomatic handgun,9mm Springfield Armory XDM semiautomatic handgun,white,Male,http://www.jsonline.com/news/milwaukee/friend-of-page-feared-what-he-might-do-426edmg-165668826.html; http://usnews.nbcnews.com/_news/2012/09/10/13785426-officer-arriving-at-sikh-temple-shooting-time-to-use-deadly-force?lite; http://articles.latimes.com/2012/aug/08/nation/la-na-nn-sikh-shooting-guns-20120807; http://www.bbc.co.uk/news/world-us-canada-19183359,http://www.jsonline.com/news/milwaukee/friend-of-page-feared-what-he-might-do-426edmg-165668826.html,http://www.jsonline.com/news/milwaukee/friend-of-page-feared-what-he-might-do-426edmg-165668826.html; http://usnews.nbcnews.com/_news/2012/09/10/13785426-officer-arriving-at-sikh-temple-shooting-time-to-use-deadly-force?lite; http://articles.latimes.com/2012/aug/08/nation/la-na-nn-sikh-shooting-guns-20120807; http://www.bbc.co.uk/news/world-us-canada-19183359,42.8858503,-87.8631362,Mass,2012,"Oak Creek, Wisconsin",9,Wisconsin,Low Unemployment,,Low Fatalities
Aurora theater shooting,"Aurora, Colorado",41110,"James Holmes, 24, opened fire in a movie theater during the opening night of ""The Dark Night Rises"" and was later arrested outside.",12,70,82,Other,24,Yes,He saw at least three mental health professionals before dropping out of his university.,Yes,"Gander Mountain stores in Thornton and Aurora, Colo.; Bass Pro Shop in Denver, Colo.; BulkAmmo.com","Two semiautomatic handguns, one rifle (assault), one shotgun",Two .40-caliber Glock semiautomatic handguns; .223-caliber Smith & Wesson M&P15 semiautomatic rifle; 12-gauge Remington 870 pump-action shotgun,white,Male,http://www.cbsnews.com/8301-201_162-57497820/james-holmes-saw-three-mental-health-professionals-before-shooting/; http://www.9news.com/news/article/283503/188/Aurora-shooting-prompts-gun-bills-in-big-states-; http://www.nytimes.com/2012/07/21/us/shooting-at-colorado-theater-showing-batman-movie.html; http://www.motherjones.com/politics/2012/07/batman-theater-shooting-updates-dark-knight-rises,http://www.cbsnews.com/8301-201_162-57497820/james-holmes-saw-three-mental-health-professionals-before-shooting/,http://www.cbsnews.com/8301-201_162-57497820/james-holmes-saw-three-mental-health-professionals-before-shooting/; http://www.9news.com/news/article/283503/188/Aurora-shooting-prompts-gun-bills-in-big-states-; http://www.nytimes.com/2012/07/21/us/shooting-at-colorado-theater-showing-batman-movie.html; http://www.motherjones.com/politics/2012/07/batman-theater-shooting-updates-dark-knight-rises,39.706038,-104.820594,Spree,2012,"Aurora, Colorado",8,Colorado,Low Unemployment,,More Fatalities
Seattle cafe shooting,"Seattle, Washington",41049,"Ian Stawicki, 40, gunned down four patrons at a cafe, and another person during a carjacking nearby, then shot himself as police closed in. (He died later that day in a Seattle hospital.)",6,1,7,Other,40,Yes,His family said he was mentally ill,Yes,"Bull's Eye Shooter Supply in Tacoma, Wash.",Two semiautomatic handguns,Two .45-caliber semiautomatic handguns,white,Male,http://usnews.nbcnews.com/_news/2012/05/30/11959312-six-killed-in-seattle-shootings-including-suspect?lite; http://www.cbsnews.com/8301-201_162-57445177/seattle-shooting-hero-hurled-stools-at-gunman-ian-stawicki-saved-three-lives/?pageNum=2&tag=contentMain;contentBody; http://content.usatoday.com/communities/ondeadline/post/2012/05/seattle-killer-had-concealed-carry-permit-owned-6-guns/1#.UFI9shhgspQ,http://usnews.nbcnews.com/_news/2012/05/30/11959312-six-killed-in-seattle-shootings-including-suspect?lite,http://usnews.nbcnews.com/_news/2012/05/30/11959312-six-killed-in-seattle-shootings-including-suspect?lite; http://www.cbsnews.com/8301-201_162-57445177/seattle-shooting-hero-hurled-stools-at-gunman-ian-stawicki-saved-three-lives/?pageNum=2&tag=contentMain;contentBody; http://content.usatoday.com/communities/ondeadline/post/2012/05/seattle-killer-had-concealed-carry-permit-owned-6-guns/1#.UFI9shhgspQ,47.6038321,-122.3300624,Mass,2012,"Seattle, Washington",10,Washington,High Umemployment,,Low Fatalities
Oikos University killings,"Oakland, California",41001,"One L. Goh, 43, a former student, opened fire in a nursing classroom. He fled the scene by car and was arrested nearby a few hours later.",7,3,10,School,43,Yes,"A former instructor at Oikos described him as ""mentally unstable"" and ""paranoid.""",Yes,"Bullseye in Castro Valley, Calif.",One semiautomatic handgun,.45-caliber semiautomatic handgun,Asian,Male,http://blog.sfgate.com/eguillermo/2012/04/05/something-still-doesnt-compute-in-the-one-goh-nightmare/; http://www.mercurynews.com/top-stories/ci_20308252/police-respond-shooting-east-oakland; http://www.cbsnews.com/8301-504083_162-57408732-504083/gun-used-in-oikos-university-shooting-rampage-was-bought-legally-police-say/; http://berkeley.patch.com/articles/one-l-goh-showed-violent-tendencies-before-the-oikos-university-shooting-oikos-university-shooting,http://berkeley.patch.com/articles/one-l-goh-showed-violent-tendencies-before-the-oikos-university-shooting-oikos-university-shooting; http://blog.sfgate.com/eguillermo/2012/04/05/something-still-doesnt-compute-in-the-one-goh-nightmare/,http://blog.sfgate.com/eguillermo/2012/04/05/something-still-doesnt-compute-in-the-one-goh-nightmare/; http://www.mercurynews.com/top-stories/ci_20308252/police-respond-shooting-east-oakland; http://www.cbsnews.com/8301-504083_162-57408732-504083/gun-used-in-oikos-university-shooting-rampage-was-bought-legally-police-say/; http://berkeley.patch.com/articles/one-l-goh-showed-violent-tendencies-before-the-oikos-university-shooting-oikos-university-shooting,37.8043808,-122.2708166,Mass,2012,"Oakland, California",10,California,High Umemployment,,Low Fatalities
Su Jung Health Sauna shooting,"Norcross, Georgia",40960,"Jeong Soo Paek, 59, returned to a Korean spa from which he'd been kicked out after an altercation. He gunned down two of his sisters and their husbands before committing suicide.",5,0,5,Other,59,Yes,His sister worried about his homicidal tendencies; she said his mental health had been deteriorating and that he had threatened to commit suicide with his gun.,Yes,Unknown,One semiautomatic handgun,.45-caliber semiautomatic handgun,Asian,Male,http://www.gwinnettdailypost.com/news/2012/feb/23/police-id-4-victims-shooter-in-spa-killing/; http://www.cbsnews.com/8301-504083_162-57479989-504083/shooting-sprees-in-2012-crimesider-reports-on-some-of-the-countrys-worst-public-shootings-this-year/; http://chronicle.augusta.com/news/metro/2012-02-22/victims-korean-spa-shooting-near-atlanta-were-2-married-couples-gunman-was; http://onlineathens.com/local-news/2012-02-23/mass-shooting-spa-shocks-ga-korean-community,http://www.gwinnettdailypost.com/news/2012/feb/23/police-id-4-victims-shooter-in-spa-killing/,http://www.gwinnettdailypost.com/news/2012/feb/23/police-id-4-victims-shooter-in-spa-killing/; http://www.cbsnews.com/8301-504083_162-57479989-504083/shooting-sprees-in-2012-crimesider-reports-on-some-of-the-countrys-worst-public-shootings-this-year/; http://chronicle.augusta.com/news/metro/2012-02-22/victims-korean-spa-shooting-near-atlanta-were-2-married-couples-gunman-was; http://onlineathens.com/local-news/2012-02-23/mass-shooting-spa-shocks-ga-korean-community,33.9412127,-84.2135309,Mass,2012,"Norcross, Georgia",7,Georgia,High Umemployment,,Low Fatalities
Seal Beach shooting,"Seal Beach, California",40828,"Scott Evans Dekraai, 42, opened fire inside a hair salon and was later arrested. Victims killed in the attack included his ex-wife, who Dekraai had a history of violently abusing, according to court records. The two had also been involved in a bitter custody battle.",8,1,9,Other,42,Yes,"He suffered from bipolar disorder, mood swings, and PTSD. After an assault on his elderly stepfather, he was sentenced in 2008 to a year of anger management therapy.",Yes,Unknown,"Two semiautomatic handguns, one revolver",".45-caliber Heckler & Koch, 9mm Springfield semiautomatic handguns; .44 Magnum Smith & Wesson revolver",white,Male,http://laist.com/2011/10/13/seal_beach_shooter_suffered_from_ptsd.php; http://blogs.ocweekly.com/navelgazing/2011/10/hair_salon_seal_beach_shooting.php; http://latimesblogs.latimes.com/lanow/2011/10/seal-beach-shooting-suspect-had-been-ordered-not-to-carry-guns-.html; http://articles.latimes.com/2011/oct/12/local/la-me-1013-seal-beach-shooting-20111013,http://laist.com/2011/10/13/seal_beach_shooter_suffered_from_ptsd.php,http://laist.com/2011/10/13/seal_beach_shooter_suffered_from_ptsd.php; http://blogs.ocweekly.com/navelgazing/2011/10/hair_salon_seal_beach_shooting.php; http://latimesblogs.latimes.com/lanow/2011/10/seal-beach-shooting-suspect-had-been-ordered-not-to-carry-guns-.html; http://articles.latimes.com/2011/oct/12/local/la-me-1013-seal-beach-shooting-20111013; https://www.nydailynews.com/news/national/seal-beach-shooting-scott-evans-dekraai-arrested-deadly-hair-salon-rampage-left-8-dead-article-1.962942,33.741176,-118.1046356,Mass,2011,"Seal Beach, California",10,California,High Umemployment,,Low Fatalities
IHOP shooting,"Carson City, Nevada",40792,"Eduardo Sencion, 32, opened fire at an International House of Pancakes restaurant and later died from a self-inflicted gunshot wound.",5,7,12,Other,32,Yes,He was diagnosed with paranoid schizophrenia as a teenager and feared demons were out to get him.,Yes,Purchased from an individual,"Two rifles (both assault), one revolver","AK-47 Norinco Arms variant, AK-47 Romarm Cugir variant rifles; .38-caliber Colt revolver",Latino,Male,http://www.huffingtonpost.com/2011/11/03/eduardo-sencion-ihop-shooter_n_1073677.html; http://www.lasvegassun.com/news/2011/sep/06/report-seven-shot-inside-carson-city-ihop/; http://www.lasvegassun.com/news/2011/oct/23/nv-gun-laws-rampage-2nd-ld-writethru/,http://www.huffingtonpost.com/2011/11/03/eduardo-sencion-ihop-shooter_n_1073677.html,http://www.huffingtonpost.com/2011/11/03/eduardo-sencion-ihop-shooter_n_1073677.html; http://www.lasvegassun.com/news/2011/sep/06/report-seven-shot-inside-carson-city-ihop/; http://www.lasvegassun.com/news/2011/oct/23/nv-gun-laws-rampage-2nd-ld-writethru/,39.1637984,-119.7674034,Mass,2011,"Carson City, Nevada",6,Nevada,High Umemployment,,Low Fatalities
Tucson shooting,"Tucson, Arizona",40551,"Jared Loughner, 22, opened fire outside a Safeway during a constituent meeting with Congresswoman Gabrielle Giffords (D-Ariz.) before he was subdued by bystanders and arrested.",6,13,19,Other,22,Yes,"His symptoms pointed to various possible mental illness diagnoses, such as schizophrenia and delusional disorder. He also experimented with pot and hallucinogens.",Yes,"Sportsmen's Warehouse in Tucson, Ariz.",One semiautomatic handgun,9mm Glock 19 semiautomatic handgun,white,Male,"http://www.time.com/time/magazine/article/0,9171,2042358,00.html; http://www.csmonitor.com/USA/Politics/2011/0110/Why-Jared-Loughner-was-allowed-to-buy-a-gun; http://www.nytimes.com/2011/01/09/us/politics/09giffords.html?ref=jaredleeloughner","http://www.time.com/time/magazine/article/0,9171,2042358,00.html","http://www.time.com/time/magazine/article/0,9171,2042358,00.html; http://www.csmonitor.com/USA/Politics/2011/0110/Why-Jared-Loughner-was-allowed-to-buy-a-gun; http://www.nytimes.com/2011/01/09/us/politics/09giffords.html?ref=jaredleeloughner",32.335941,-110.975132,Mass,2011,"Tucson, Arizona",7,Arizona,High Umemployment,,Low Fatalities
Hartford Beer Distributor shooting,"Manchester, Connecticut",40393,"Omar S. Thornton, 34, shot up his Hartford Beer Distributor workplace after facing disciplinary issues, then committed suicide.",9,2,11,Workplace,34,No,"He apparently was driven over the edge by unaddressed, ongoing racism against him at work",Yes,"Gun dealer in East Windsor, Conn.",Two semiautomatic handguns,Two 9mm Ruger SR9 semiautomatic handguns,black,Male,http://www.cbsnews.com/8301-504083_162-20012557-504083.html; http://www.msnbc.msn.com/id/38535909/ns/us_news-crime_and_courts/t/dead-shooting-conn-beer-distributor/#.UFGJAqRrND4; http://www.foxnews.com/us/2010/08/03/dead-wounded-conn-workplace-shooting/,http://www.cbsnews.com/8301-504083_162-20012557-504083.html,http://www.cbsnews.com/8301-504083_162-20012557-504083.html; http://www.msnbc.msn.com/id/38535909/ns/us_news-crime_and_courts/t/dead-shooting-conn-beer-distributor/#.UFGJAqRrND4; http://www.foxnews.com/us/2010/08/03/dead-wounded-conn-workplace-shooting/,41.798764,-72.570068,Mass,2010,"Manchester, Connecticut",11,Connecticut,Low Unemployment,,More Fatalities
Coffee shop police killings,"Parkland, Washington",40146,"Maurice Clemmons, 37, a felon who was out on bail for child-rape charges, entered a coffee shop on a Sunday morning and shot four police officers who had gone there to use their laptops before their shifts. Clemmons, who was wounded fleeing the scene, was later shot dead by a police officer in Seattle after a two-day manhunt.",4,1,5,Other,37,Yes,"He had a history of erratic, bizarre behavior. He once asked his family to get naked for 5 minutes on Sunday; he said he thought the world would end and that he was Jesus.",No,Stolen from an individual in Seattle.,One semiautomatic handgun,9mm Glock 17 semiautomatic handgun; .38-caliber Smith & Wesson revolver,black,Male,http://seattletimes.com/html/localnews/2010385617_webmansought29.html; http://www.nytimes.com/2009/11/30/us/30tacoma.html?_r=1; http://seattletimes.com/html/localnews/2014155225_clemmons08m.html,http://seattletimes.com/html/localnews/2010385617_webmansought29.html,http://seattletimes.com/html/localnews/2010385617_webmansought29.html; http://www.nytimes.com/2009/11/30/us/30tacoma.html?_r=1; http://seattletimes.com/html/localnews/2014155225_clemmons08m.html,47.15277,-122.467308,Mass,2009,"Parkland, Washington",10,Washington,High Umemployment,,Low Fatalities
Binghamton shootings,"Binghamton, New York",39906,"Jiverly Wong, 41, opened fire at an American Civic Association center for immigrants before committing suicide.",14,4,18,Other,41,Yes,He apparently harbored growing paranoia toward cops. He also sent a delusional letter to a local TV station right before the shooting.,Yes,"Gander Mountain in Johnson City, N.Y.",Two semiautomatic handguns,"9mm Beretta, .45-caliber Springfield semiautomatic handguns",Asian,Male,http://www.nytimes.com/2009/04/12/nyregion/12binghamton.html?pagewanted=all&_r=0; http://www.nytimes.com/2009/04/04/nyregion/04hostage.html?pagewanted=all,http://www.nytimes.com/2009/04/12/nyregion/12binghamton.html?pagewanted=all&_r=1&,http://www.nytimes.com/2009/04/12/nyregion/12binghamton.html?pagewanted=all&_r=0; http://www.nytimes.com/2009/04/04/nyregion/04hostage.html?pagewanted=all,42.099802,-75.917723,Mass,2009,"Binghamton, New York",8,New York,High Umemployment,,More Fatalities
Carthage nursing home shooting,"Carthage, North Carolina",39901,"Robert Stewart, 45, opened fire at a nursing home where his estranged wife worked before he was shot and arrested by a police officer.",8,3,11,Other,45,Yes,"His estranged wife told her workplace that her husband had an ""unstable mental state or (was) mentally ill.""",Yes,Local sporting goods stores and individuals,"One revolver, one shotgun",Winchester 1300 pump-action shotgun; .357 Magnum revolver,white,Male,http://www.wral.com/news/local/story/9845639/; http://www.wral.com/news/local/story/4837676/,http://www.wral.com/news/local/story/9845639/,http://www.wral.com/news/local/story/9845639/; http://www.wral.com/news/local/story/4837676/,35.333434,-79.414592,Mass,2009,"Carthage, North Carolina",14,North Carolina,Low Unemployment,,Low Fatalities
Atlantis Plastics shooting,"Henderson, Kentucky",39624,"Disgruntled employee Wesley Neal Higdon, 25, shot up an Atlantis Plastics factory after he was escorted out of his workplace for an argument with a supervisor. Higdon shot the supervisor outside the factory before opening fire on coworkers inside. He then committed suicide.",6,1,7,Workplace,25,No,He called his girlfriend two hours before the shooting to say he was going to kill his boss.,Yes,Unknown,One semiautomatic handgun,.45-caliber Hi-Point semiautomatic handgun,white,Male,"http://www.foxnews.com/story/0,2933,371242,00.html; http://www.msnbc.msn.com/id/25393695/ns/us_news-crime_and_courts/t/witnesses-describe-chaotic-scene-ky-plant/#.UFEbHhhgspQ","http://www.foxnews.com/story/0,2933,371242,00.html","http://www.foxnews.com/story/0,2933,371242,00.html; http://www.msnbc.msn.com/id/25393695/ns/us_news-crime_and_courts/t/witnesses-describe-chaotic-scene-ky-plant/#.UFEbHhhgspQ",37.76721,-87.5573742,Spree,2008,"Henderson, Kentucky",8,Kentucky,High Umemployment,,Low Fatalities
Northern Illinois University shooting,"DeKalb, Illinois",39492,"Steven Kazmierczak, 27, opened fire in a lecture hall, then shot and killed himself before police arrived.",5,21,26,School,27,Yes,"He had a long history of mental health struggles; after high school, his parents placed him at a psychiatric treatment center. He told friends he left the Army after six months due to a psychological discharge. ",Yes,"Online and gun retailers in Champaign, Ill. ","Three semiautomatic handguns, one shotgun","9mm Glock 19, Hi-Point CF380, 9mm Kurz SIG Sauer P232 semiautomatic handguns; 12-gauge Remington Sportsman 48 sawed-off shotgun",white,Male,http://www.huffingtonpost.com/jonathan-fast/steve-kazmierczak-the-sec_b_87031.html; http://www.msnbc.msn.com/id/23171567/ns/us_news-crime_and_courts/t/college-shooters-deadly-rampage-baffles-friends/#.UFEZnhhgspQ; http://www.nytimes.com/slideshow/2008/02/14/us/0214-SHOOTING_index.html?ref=schoolshooting&gwh=B62598A5487B946A532C5846B4A85156; www.niu.edu/feb14report/Feb14report.pdf,http://www.cbsnews.com/stories/2008/02/16/national/main3840072.shtml; http://www.esquire.com/news-politics/a4863/steven-kazmierczak-0808/,http://www.huffingtonpost.com/jonathan-fast/steve-kazmierczak-the-sec_b_87031.html; http://www.msnbc.msn.com/id/23171567/ns/us_news-crime_and_courts/t/college-shooters-deadly-rampage-baffles-friends/#.UFEZnhhgspQ; http://www.nytimes.com/slideshow/2008/02/14/us/0214-SHOOTING_index.html?ref=schoolshooting&gwh=B62598A5487B946A532C5846B4A85156; www.niu.edu/feb14report/Feb14report.pdf,41.9294736,-88.7503647,Mass,2008,"DeKalb, Illinois",8,Illinois,High Umemployment,,Low Fatalities
Kirkwood City Council shooting,"Kirkwood, Missouri",39485,"Charles ""Cookie"" Lee Thornton, 52, went on a rampage at the city hall before being shot and killed by police.",6,2,8,Other,52,No,He was known for histrionics and disruptions at city council meetings. His mounting debt was a stressor.,No,Taken in burglary and from fallen police officer,"One semiautomatic handgun, one revolver",.40-caliber Smith & Wesson semiautomatic handgun; .44 Magnum Smith & Wesson Model 29 revolver,black,Male,http://www.stltoday.com/news/local/crime-and-courts/charles-lee-cookie-thornton-behind-the-smile/article_be96f13c-78b9-11df-bfdc-0017a4a78c22.html; http://www.nytimes.com/2008/02/08/us/08missouri.html; http://nl.newsbank.com/nl-search/we/Archives?p_product=SL&p_theme=sl&p_action=search&p_maxdocs=200&p_topdoc=1&p_text_direct-0=11F1CADA291472F0&p_field_direct-0=document_id&p_perpage=10&p_sort=YMD_date:D&s_trackval=GooglePM,http://www.stltoday.com/news/local/crime-and-courts/charles-lee-cookie-thornton-behind-the-smile/article_be96f13c-78b9-11df-bfdc-0017a4a78c22.html,http://www.stltoday.com/news/local/crime-and-courts/charles-lee-cookie-thornton-behind-the-smile/article_be96f13c-78b9-11df-bfdc-0017a4a78c22.html; http://www.nytimes.com/2008/02/08/us/08missouri.html; http://nl.newsbank.com/nl-search/we/Archives?p_product=SL&p_theme=sl&p_action=search&p_maxdocs=200&p_topdoc=1&p_text_direct-0=11F1CADA291472F0&p_field_direct-0=document_id&p_perpage=10&p_sort=YMD_date:D&s_trackval=GooglePM,38.580093,-90.40691,Mass,2008,"Kirkwood, Missouri",8,Missouri,High Umemployment,,Low Fatalities
Westroads Mall shooting,"Omaha, Nebraska",39421,"Robert A. Hawkins, 19, opened fire inside Westroads Mall before committing suicide.",9,4,13,Other,19,Yes,He had been treated in the past for depression and ADHD. ,No,Stolen from grandfather,One rifle (assault),WASR-10 Century Arms semiautomatic rifle,white,Male,"http://www.guardian.co.uk/world/2007/dec/06/usa.usgunviolence2; http://www.npr.org/templates/story/story.php?storyId=16962485; http://www.independentmail.com/news/2007/dec/08/officials-say-assault-rifles-cause-roughly-same-am/; http://www.latimes.com/news/nationworld/nation/la-na-mall7dec07,0,882178.story",http://www.guardian.co.uk/world/2007/dec/06/usa.usgunviolence2,"http://www.guardian.co.uk/world/2007/dec/06/usa.usgunviolence2; http://www.npr.org/templates/story/story.php?storyId=16962485; http://www.independentmail.com/news/2007/dec/08/officials-say-assault-rifles-cause-roughly-same-am/; http://www.latimes.com/news/nationworld/nation/la-na-mall7dec07,0,882178.story",41.265719,-96.067495,Spree,2007,"Omaha, Nebraska",8,Nebraska,Low Unemployment,,More Fatalities
Virginia Tech massacre,"Blacksburg, Virginia",39188,"Virginia Tech student Seung-Hui Cho, 23, opened fire on his school's campus before committing suicide.",32,23,55,School,23,Yes,"A district court ruled Cho was ""an imminent danger"" to himself and others as a result of mental illness two years earlier, and directed Cho to seek treatment. ",Yes,"Purchased variously online and from Roanoke Firearms in Roanoke, Va.",Two semiautomatic handguns,"9mm Glock 19, .22-caliber Walther P22 semiautomatic handguns",Asian,Male,http://www.nytimes.com/2007/04/24/us/24virginia.html; http://www.thestandard.com.hk/news_detail.asp?we_cat=9&art_id=42489&sid=13196711&con_type=1&d_str=20070419&fc=10; http://smartgunlaws.org/mental-health-reporting-policy-summary/,http://abcnews.go.com/US/story?id=3052278&page=1,http://www.nytimes.com/2007/04/24/us/24virginia.html; http://www.thestandard.com.hk/news_detail.asp?we_cat=9&art_id=42489&sid=13196711&con_type=1&d_str=20070419&fc=10; http://smartgunlaws.org/mental-health-reporting-policy-summary/,37.2295733,-80.4139393,Mass,2007,"Blacksburg, Virginia",8,Virginia,Low Unemployment,,More Fatalities
