case,location,date,summary,fatalities,injured,total_victims,location,age_of_shooter,prior_signs_mental_health_issues,mental_health_details,legal_weapon,where_obtained,weapon_type,weapon_details,race,gender,sources,mental_health_sources,sources_additional_age,latitude,longitude,type,year,Place,,State,Hist_Unemp_St,,Fatality Status
Air Force base shooting,"Fairchild Air Force Base, Washington",34505,"Former airman Dean Allen Mellberg, 20, opened fire inside a hospital at the Fairchild Air Force Base before he was shot dead by a military police officer outside.",5,23,28,Military,20,Yes,He was repeatedly diagnosed with emotional problems during his two years of service.,Yes,"Gun dealer in Spokane, Wash.",One rifle (assault),MAK-90 semiautomatic rifle,white,Male,http://articles.latimes.com/1994-06-22/news/mn-7137_1_air-force; http://www.nytimes.com/1994/06/22/us/an-airman-s-revenge-5-minutes-of-terror.html,http://articles.latimes.com/1994-06-22/news/mn-7137_1_air-force,http://articles.latimes.com/1994-06-22/news/mn-7137_1_air-force; http://www.nytimes.com/1994/06/22/us/an-airman-s-revenge-5-minutes-of-terror.html,47.61864486,-117.6483587,Mass,1994,"Fairchild Air Force Base, Washington",10,Washington,High Umemployment,,Low Fatalities
Long Island Rail Road massacre,"Garden City, New York",34310,"Colin Ferguson, 35, opened fire on an eastbound Long Island Rail Road train as it approached a Garden City station. He was later arrested.",6,19,25,Other,35,Yes,"Psychiatrists and others said he suffered from racial paranoia and was obsessed with nonexistent conspiracies. His landlord said he had ""delusions of grandeur.""",Yes,"Turner's Outdoorsman in Signal Hill, Calif. ",One semiautomatic handgun,9mm Ruger P89 semiautomatic handgun,black,Male,http://www.nytimes.com/1993/12/12/nyregion/tormented-life-special-report-long-slide-privilege-ends-slaughter-train.html; http://www.vpc.org/studies/wgun931207.htm,http://www.nytimes.com/1993/12/12/nyregion/tormented-life-special-report-long-slide-privilege-ends-slaughter-train.html,http://www.nytimes.com/1993/12/12/nyregion/tormented-life-special-report-long-slide-privilege-ends-slaughter-train.html; http://www.vpc.org/studies/wgun931207.htm,40.7267682,-73.6342955,Spree,1993,"Garden City, New York",8,New York,High Umemployment,,Low Fatalities
Luigi's shooting,"Fayetteville, North Carolina",34187,"Army Sgt. Kenneth Junior French, 22, opened fire inside Luigi's Italian restaurant while ranting about gays in the military before he was shot and arrested by police.",4,8,12,Other,22,No,"He had an abusive father, who committed suicide.",Yes,Unknown,"One rifle, two shotguns",.22-caliber rifle; two 12-gauge shotguns,white,Male,"http://articles.latimes.com/1993-08-08/news/mn-21847_1_kills-army-french; http://news.google.com/newspapers?id=0AhPAAAAIBAJ&sjid=jhUEAAAAIBAJ&pg=6505,2482529&dq=kenneth+junior+french&hl=en","http://news.google.com/newspapers?id=0AhPAAAAIBAJ&sjid=jhUEAAAAIBAJ&pg=6505,2482529&dq=kenneth+junior+french&hl=en","http://articles.latimes.com/1993-08-08/news/mn-21847_1_kills-army-french; http://news.google.com/newspapers?id=0AhPAAAAIBAJ&sjid=jhUEAAAAIBAJ&pg=6505,2482529&dq=kenneth+junior+french&hl=en",35.0529931,-78.8787058,Mass,1993,"Fayetteville, North Carolina",14,North Carolina,Low Unemployment,,Low Fatalities
101 California Street shootings,"San Francisco, California",34151,"Failed businessman Gian Luigi Ferri, 55, opened fire throughout an office building before he committed suicide inside as police pursued him.",9,6,15,Other,55,No,"He was down on his luck because of failed business decisions. One acquaintance said, ""He was the least likely guy you can imagine doing something like that.""  His ex-wife said he ""hated violence.""",No,"Super Pawn and Pacific Tactical Weapons, both in Las Vegas, Nev.",Three semiautomatic handguns (two assault),"Two Intratec DC-9, .45-caliber Colt semiautomatic handguns",white,Male,http://articles.latimes.com/1993-07-03/news/mn-10731_1_mortgage-business/2; http://www.motherjones.com/print/16316; http://www.vpc.org/studies/wgun930701.htm,http://articles.latimes.com/1993-07-03/news/mn-10731_1_mortgage-business,http://articles.latimes.com/1993-07-03/news/mn-10731_1_mortgage-business/2; http://www.motherjones.com/print/16316; http://www.vpc.org/studies/wgun930701.htm,37.792968,-122.397973,Mass,1993,"San Francisco, California",10,California,High Umemployment,,More Fatalities
Watkins Glen killings,"Watkins Glen, New York",33892,"John T. Miller, 50, killed four child-support workers in a county office building before turning the gun on himself.  Miller was upset about a court order garnishing his paycheck to cover overdue child-support payments.",5,0,5,Other,50,Yes,"The day before the shooting, he told child-support collection office workers that he was considering suicide. He had been convicted of felonious assault for pointing a revolver at police officers responding to a domestic violence report at this girlfriend's apartment. ",Yes,"Mumford Sports in Litchfield, Ohio",One semiautomatic handgun,9mm Llama semiautomatic handgun,white,Male,http://www.nytimes.com/1992/10/17/nyregion/shooting-followed-tougher-efforts-to-collect-child-support.html?pagewanted=2&src=pm; http://www.nytimes.com/1992/10/16/nyregion/gunman-kills-4-who-collected-child-payments.html?pagewanted=all&src=pm; http://www.nytimes.com/1992/10/24/nyregion/watkins-glen-killings-called-planned.html,http://www.nytimes.com/1992/10/24/nyregion/watkins-glen-killings-called-planned.html,http://www.nytimes.com/1992/10/17/nyregion/shooting-followed-tougher-efforts-to-collect-child-support.html?pagewanted=2&src=pm; http://www.nytimes.com/1992/10/16/nyregion/gunman-kills-4-who-collected-child-payments.html?pagewanted=all&src=pm; http://www.nytimes.com/1992/10/24/nyregion/watkins-glen-killings-called-planned.html,42.3810555,-76.8705777,Mass,1992,"Watkins Glen, New York",8,New York,High Umemployment,,Low Fatalities
Lindhurst High School shooting,"Olivehurst, California",33725,"Former Lindhurst High School student Eric Houston, 20, angry about various personal failings, killed three students and a teacher at the school before surrendering to police after an eight-hour standoff. He was later sentenced to death.",4,10,14,School,20,No,"He suffered violent physical abuse as a child. He claimed a teacher had sexually abused him, but the truth of that allegation was contested. ",Yes,Local gun retailer,"One rifle, one shotgun",.22-caliber sawed-off rifle; 12-gauge pump-action shotgun,white,Male,http://www.schoolshooters.info/PL/Subject-Houston_files/Nine%20Brief%20Sketches.pdf; http://www.appeal-democrat.com/news/school-47104-shooting-eckardt.html; http://nl.newsbank.com/nl-search/we/Archives?p_product=SB&p_theme=sb&p_action=search&p_maxdocs=200&p_topdoc=1&p_text_direct-0=0EB0D9D91FC593A0&p_field_direct-0=document_id&p_perpage=10&p_sort=YMD_date:D&s_trackval=GooglePM; http://www.sfgate.com/crime/article/Death-verdict-OKd-for-school-slaughter-3758444.php,http://www.schoolshooters.info/PL/Subject-Houston_files/Nine%20Brief%20Sketches.pdf,http://www.schoolshooters.info/PL/Subject-Houston_files/Nine%20Brief%20Sketches.pdf; http://www.appeal-democrat.com/news/school-47104-shooting-eckardt.html; http://nl.newsbank.com/nl-search/we/Archives?p_product=SB&p_theme=sb&p_action=search&p_maxdocs=200&p_topdoc=1&p_text_direct-0=0EB0D9D91FC593A0&p_field_direct-0=document_id&p_perpage=10&p_sort=YMD_date:D&s_trackval=GooglePM; http://www.sfgate.com/crime/article/Death-verdict-OKd-for-school-slaughter-3758444.php,39.07868761,-121.5475762,Mass,1992,"Olivehurst, California",10,California,High Umemployment,,Low Fatalities
Royal Oak postal shootings,"Royal Oak, Michigan",33556,"Laid-off postal worker Thomas McIlvane, 31, opened fire at his former workplace before committing suicide.",5,5,10,Workplace,31,Yes,Police revoked his CCW permit after determining he was mentally unstable.,Yes,Local gun store,One rifle,.22-caliber Ruger sawed-off semiautomatic rifle,white,Male,http://www.nytimes.com/1991/11/15/us/ex-postal-worker-kills-3-and-wounds-6-in-michigan.html; http://www.mlive.com/news/detroit/index.ssf/2011/11/monday_ceremony_marks_20_years.html,http://www.nytimes.com/1991/11/15/us/ex-postal-worker-kills-3-and-wounds-6-in-michigan.html,http://www.nytimes.com/1991/11/15/us/ex-postal-worker-kills-3-and-wounds-6-in-michigan.html; http://www.mlive.com/news/detroit/index.ssf/2011/11/monday_ceremony_marks_20_years.html,42.4894801,-83.1446485,Mass,1991,"Royal Oak, Michigan",8,Michigan,High Umemployment,,Low Fatalities
Luby's massacre,"Killeen, Texas",33527,"George Hennard, 35, drove his pickup truck into a Luby's cafeteria and opened fire before committing suicide.",24,20,44,Other,35,No,"Acquaintances described him as troubled, unstable, combative, and misogynistic. He made convenience store employees ""nervous.""",Yes,"Mike's Gun Shop in Henderson, Nev.",Two semiautomatic handguns,"9mm Glock 17, 9mm Ruger P89 semiautomatic handguns",white,Male,http://www.nytimes.com/1991/10/18/us/portrait-of-texas-killer-impatient-and-troubled.html?pagewanted=all&src=pm; http://www.kwtx.com/home/headlines/7048182.html; http://www.nytimes.com/1991/10/20/weekinreview/dead-23-texans-and-1-anti-gun-measure.html; http://www.vpc.org/studies/wgun911016.htm,http://www.nytimes.com/1991/10/20/weekinreview/dead-23-texans-and-1-anti-gun-measure.html; http://www.nytimes.com/1991/10/18/us/portrait-of-texas-killer-impatient-and-troubled.html?pagewanted=all&src=pm,http://www.nytimes.com/1991/10/18/us/portrait-of-texas-killer-impatient-and-troubled.html?pagewanted=all&src=pm; http://www.kwtx.com/home/headlines/7048182.html; http://www.nytimes.com/1991/10/20/weekinreview/dead-23-texans-and-1-anti-gun-measure.html; http://www.vpc.org/studies/wgun911016.htm,31.1171194,-97.7277959,Mass,1991,"Killeen, Texas",5,Texas,High Umemployment,,More Fatalities
GMAC massacre,"Jacksonville, Florida",33042,"James Edward Pough, 42, opened fire at a General Motors Acceptance Corporation office before committing suicide. (The day prior, Pough killed a pimp and prostitute and injured two others. Those victims are not included in the mass murder count.)",10,4,14,Other,42,No,"Police speculated he had a ""grudge"" against the people he killed. ",Yes,Unknown,"One rifle, one revolver",.30-caliber Universal M1 carbine rifle; .38-caliber revolver,black,Male,http://www.nytimes.com/1990/06/19/us/florida-gunman-kills-8-and-wounds-6-in-office.html; http://www.nytimes.com/1990/06/20/us/hazy-records-helped-florida-gunman-buy-arms.html; http://www.vpc.org/studies/wgun900618.htm; http://www.nytimes.com/1990/06/19/us/florida-gunman-kills-8-and-wounds-6-in-office.html?pagewanted=all&src=pm,http://www.nytimes.com/1990/06/20/us/hazy-records-helped-florida-gunman-buy-arms.html,http://www.nytimes.com/1990/06/19/us/florida-gunman-kills-8-and-wounds-6-in-office.html; http://www.nytimes.com/1990/06/20/us/hazy-records-helped-florida-gunman-buy-arms.html; http://www.vpc.org/studies/wgun900618.htm; http://www.nytimes.com/1990/06/19/us/florida-gunman-kills-8-and-wounds-6-in-office.html?pagewanted=all&src=pm,30.3321838,-81.655651,Mass,1990,"Jacksonville, Florida",7,Florida,High Umemployment,,More Fatalities
Standard Gravure shooting,"Louisville, Kentucky",32765,"Joseph T. Wesbecker, 47, gunned down eight people at his former workplace before committing suicide.",9,12,21,Workplace,47,Yes,"Prior to the shooting, he had voluntarily checked into hospitals for mental problems at least twice and attempted suicide three times. ",Yes,"AK-47 purchased from Tilford's Gun Sales in Louisville, Ky.","Three semiautomatic handguns (two assault), one rifle (assault), one revolver","Two Intratec MAC-11, 9mm SIG Sauer semiautomatic handguns; AK-47 Chinese variant semiautomatic rifle; .38-caliber revolver",white,Male,http://nl.newsbank.com/nl-search/we/Archives?p_product=LH&s_site=kentucky&p_multi=LH&p_theme=realcities&p_action=search&p_maxdocs=200&p_topdoc=1&p_text_direct-0=0EB73C025033DC82&p_field_direct-0=document_id&p_perpage=10&p_sort=YMD_date:D&s_trackval=GooglePM; http://www.nytimes.com/1989/09/16/us/disturbed-past-of-killer-of-7-is-unraveled.html?pagewanted=all&src=pm,http://www.nytimes.com/1989/09/16/us/disturbed-past-of-killer-of-7-is-unraveled.html,http://nl.newsbank.com/nl-search/we/Archives?p_product=LH&s_site=kentucky&p_multi=LH&p_theme=realcities&p_action=search&p_maxdocs=200&p_topdoc=1&p_text_direct-0=0EB73C025033DC82&p_field_direct-0=document_id&p_perpage=10&p_sort=YMD_date:D&s_trackval=GooglePM; http://www.nytimes.com/1989/09/16/us/disturbed-past-of-killer-of-7-is-unraveled.html?pagewanted=all&src=pm,38.2542376,-85.759407,Mass,1989,"Louisville, Kentucky",8,Kentucky,High Umemployment,,More Fatalities
Stockton schoolyard shooting,"Stockton, California",32525,"Patrick Purdy, 26, an alcoholic with a police record, launched an assault at Cleveland Elementary School, where many young Southeast Asian immigrants were enrolled. Purdy killed himself with a shot to the head.",6,29,35,School,26,Yes,"He told a mental health professional he was ""struggling to resist actions on thoughts which are destructive in nature."" He also suffered from alcoholism. ",Yes,"Sandy Trading Post in Sandy, Ore.; Hunter Loan and Jewelry Co. in Stockton, Calif.","One semiautomatic handgun, one rifle (assault)",9mm Taurus semiautomatic handgun; AK-47 Chinese variant semiautomatic rifle,white,Male,"http://www.recordnet.com/apps/pbcs.dll/article?AID=/20090118/A_NEWS/901170304; http://news.google.com/newspapers?id=N8IzAAAAIBAJ&sjid=kDIHAAAAIBAJ&pg=6930,6475926&dq=patrick+purdy&hl=en; http://www.time.com/time/magazine/article/0,9171,151105,00.html",http://www.recordnet.com/apps/pbcs.dll/article?AID=/20090118/A_NEWS/901170304,"http://www.recordnet.com/apps/pbcs.dll/article?AID=/20090118/A_NEWS/901170304; http://news.google.com/newspapers?id=N8IzAAAAIBAJ&sjid=kDIHAAAAIBAJ&pg=6930,6475926&dq=patrick+purdy&hl=en; http://www.time.com/time/magazine/article/0,9171,151105,00.html",37.9577016,-121.2907796,Mass,1989,"Stockton, California",10,California,High Umemployment,,Low Fatalities
ESL shooting,"Sunnyvale, California",32189,"Former ESL Incorporated employee Richard Farley, 39, gunned down seven people at his former workplace, after stalking and harassing a coworker he was romantically interested in. He was later arrested and now sits on death row at San Quentin.",7,4,11,Workplace,39,Yes,"He stalked and harassed his colleague Laura Black for four years until she was granted a temporary restraining order aginst him. Before he was fired for his bizarre behavior, he was ordered to undergo psychological counseling. ",Yes,Various sporting goods and gun stores in Northern California,"Two semiautomatic handguns, one rifle, two revolvers, two shotguns",".380 ACP Browning, 9mm Smith & Wesson semiautomatic handguns; Ruger M-77 .22-250 bolt-action rifle with scope; Mossberg 12-gauge pump-action, 12-gauge Benelli semiautomatic shotguns; .357 Magnum Smith & Wesson, .22 Sentinel WMR revolvers",white,Male,"http://articles.latimes.com/1988-02-18/news/mn-43514_1_mr-farley-richard-farley-sunnyvale-public-safety-department; http://news.google.com/newspapers?id=uqxAAAAAIBAJ&sjid=sDIHAAAAIBAJ&pg=2425,5898911&dq=richard+farley+shooting&hl=en; http://news.google.com/newspapers?id=FmYzAAAAIBAJ&sjid=WzIHAAAAIBAJ&pg=7028,576811&dq=richard+farley+shooting&hl=en",http://books.google.com/books?id=JiQUkwBnzgYC&pg=PA44&lpg=PA44&dq=richard+farley+ESL+psychological&source=bl&ots=PqxDlDtznK&sig=K-p8vEN7M2AEdRC0KpxVHjXZN7M&hl=en#v=onepage&q=richard%20farley%20ESL%20psychological&f=false; http://caselaw.findlaw.com/ca-supreme-court/1295931.html,"http://articles.latimes.com/1988-02-18/news/mn-43514_1_mr-farley-richard-farley-sunnyvale-public-safety-department; http://news.google.com/newspapers?id=uqxAAAAAIBAJ&sjid=sDIHAAAAIBAJ&pg=2425,5898911&dq=richard+farley+shooting&hl=en; http://news.google.com/newspapers?id=FmYzAAAAIBAJ&sjid=WzIHAAAAIBAJ&pg=7028,576811&dq=richard+farley+shooting&hl=en",37.3688301,-122.0363496,Mass,1988,"Sunnyvale, California",10,California,High Umemployment,,Low Fatalities
Shopping centers spree killings,"Palm Bay, Florida",31890,"Retired librarian William Cruse, 59, was paranoid neighbors gossiped that he was gay. He drove to a Publix supermarket, killing two Florida Tech students en route before opening fire outside and killing a woman. He then drove to a Winn-Dixie supermarket and killed three more, including two police officers. Cruse was arrested after taking a hostage and died on death row in 2009.",6,14,20,Other,59,Yes,"He suffered from paranoid delusions. A judge found that he suffered from ""extreme mental illness.""",Yes,"Gun store in Norwood, Ohio; The Oaks Trading Post in Melbourne, Fla.","One rifle, one revolver, one shotgun","Sturm, Ruger Mini-14 semiautomatic rifle; 20-gauge Winchester pump-action shotgun; .357 Ruger Blackhawk revolver",white,Male,http://articles.latimes.com/1987-04-25/news/mn-990_1_palm-bay-police,(Supreme Court of Florida Document) http://www.murderpedia.org/male.C/images/cruse_william_b/op-74656.pdf,http://articles.latimes.com/1987-04-25/news/mn-990_1_palm-bay-police,28.0331886,-80.6429695,Spree,1987,"Palm Bay, Florida",7,Florida,High Umemployment,,Low Fatalities
San Ysidro McDonald's massacre,"San Ysidro, California",30881,"James Oliver Huberty, 41, opened fire in a McDonald's restaurant before he was shot dead by a police officer.",22,19,41,Other,41,Yes,"The day before the shooting, he tried to make an appointment at a mental health clinic. ",Yes,Unknown,"One semiautomatic handgun, one rifle (assault), one shotgun",9mm Browning P35 Hi-Power semiautomatic handgun; 9mm Israeli Military Industries Uzi Model A carbine semiautomatic rifle; 12-gauge Winchester 1200 pump-action shotgun,white,Male,http://www.utsandiego.com/san-ysidro-massacre/; http://www.vpc.org/studies/wgun840718.htm,http://www.nctimes.com/news/local/article_2ba4343e-7009-54ce-98df-79a23ff8d0d7.html,http://www.utsandiego.com/san-ysidro-massacre/; http://www.vpc.org/studies/wgun840718.htm,32.5520013,-117.0430813,Mass,1984,"San Ysidro, California",10,California,High Umemployment,,More Fatalities
Dallas nightclub shooting,"Dallas, Texas",30862,"Abdelkrim Belachheb, 39, opened fire at an upscale nightclub after a woman rejected his advances. He was later arrested.",6,1,7,Other,39,Yes,"During his last meal with his wife, he confessed he was depressed and had visited psychiatric hospitals in Belgium.",No,"Hines Boulevard Pawn Shop in Dallas, Texas",One semiautomatic handgun,9mm Smith & Wesson 459 semiautomatic handgun,white,Male,"http://books.google.com/books?id=Hr3OBwP-lbUC&pg=PA38&lpg=PA38&dq=Abdelkrim+Belachheb+mental&source=bl&ots=D56pgdNnnl&sig=grAT08P9HLfPoHVgwlXt8RfPHz0&hl=en&; http://www.nytimes.com/1984/06/30/us/6-die-in-dallas-club-as-enraged-man-fires-wildly.html; http://news.google.com/newspapers?id=gKQyAAAAIBAJ&sjid=WO8FAAAAIBAJ&pg=1236,2915759&dq=abdelkrim+belachheb&hl=en; http://books.google.com/books?id=Hr3OBwP-lbUC&pg=PA67&lpg=PA67&dq=%22hine+pawnshop%22+gun&source=bl&ots=D55vgfTsnk&sig=zDxr5nohKnNQWvLrUFmZGYQ5ar4&hl=en&sa=X&ei=9WZSUN2FN-XZigKN-oGoCA&ved=0CDcQ6AEwAA#v=onepage&q=%22hine%20pawnshop%22%20gun&f=false",http://books.google.com/books?id=Hr3OBwP-lbUC&pg=PA67&lpg=PA67&dq=%22hine+pawnshop%22+gun&source=bl&ots=D55vgfTsnk&sig=zDxr5nohKnNQWvLrUFmZGYQ5ar4&hl=en&sa=X&ei=9WZSUN2FN-XZigKN-oGoCA&ved=0CDcQ6AEwAA#v=onepage&q=%22hine%20pawnshop%22%20gun&f=false,"http://books.google.com/books?id=Hr3OBwP-lbUC&pg=PA38&lpg=PA38&dq=Abdelkrim+Belachheb+mental&source=bl&ots=D56pgdNnnl&sig=grAT08P9HLfPoHVgwlXt8RfPHz0&hl=en&; http://www.nytimes.com/1984/06/30/us/6-die-in-dallas-club-as-enraged-man-fires-wildly.html; http://news.google.com/newspapers?id=gKQyAAAAIBAJ&sjid=WO8FAAAAIBAJ&pg=1236,2915759&dq=abdelkrim+belachheb&hl=en; http://books.google.com/books?id=Hr3OBwP-lbUC&pg=PA67&lpg=PA67&dq=%22hine+pawnshop%22+gun&source=bl&ots=D55vgfTsnk&sig=zDxr5nohKnNQWvLrUFmZGYQ5ar4&hl=en&sa=X&ei=9WZSUN2FN-XZigKN-oGoCA&ved=0CDcQ6AEwAA#v=onepage&q=%22hine%20pawnshop%22%20gun&f=false",32.925166,-96.838676,Mass,1984,"Dallas, Texas",5,Texas,High Umemployment,,Low Fatalities
Welding shop shooting,"Miami, Florida",30183,"Junior high school teacher Carl Robert Brown, 51, opened fire inside a welding shop and was later shot dead by a witness as he fled the scene.",8,3,11,Other,51,Yes,"His second wife left him because he refused to seek psychological help. He had become increasingly isolated. One former student said he was ""off his rocker.""",Yes,"Garcia Gun Center in Hialeah, Fla.",One shotgun,Mossberg 500 Persuader pump-action shotgun with pistol grip,white,Male,http://www.nytimes.com/1982/08/21/us/gunman-in-miami-kills-8-in-rampage.html; http://www.nytimes.com/1982/08/24/us/no-charges-planned-against-miami-man-who-shot-gunman.html; http://www.nytimes.com/1982/10/14/us/florida-city-rescinds-law-on-buying-guns.html,"http://news.google.com/newspapers?id=uuYLAAAAIBAJ&sjid=C1kDAAAAIBAJ&pg=4879,1435085&dq=carl+robert+brown",http://www.nytimes.com/1982/08/21/us/gunman-in-miami-kills-8-in-rampage.html; http://www.nytimes.com/1982/08/24/us/no-charges-planned-against-miami-man-who-shot-gunman.html; http://www.nytimes.com/1982/10/14/us/florida-city-rescinds-law-on-buying-guns.html,25.796491,-80.226683,Mass,1982,"Miami, Florida",7,Florida,High Umemployment,,Low Fatalities