case,location,date,summary,fatalities,injured,total_victims,location,age_of_shooter,prior_signs_mental_health_issues,mental_health_details,legal_weapon,where_obtained,weapon_type,weapon_details,race,gender,sources,mental_health_sources,sources_additional_age,latitude,longitude,type,year,Place,,State,Hist_Unemp_St,,Fatality Status
Amish school shooting,"Lancaster County, Pennsylvania",38992,"Charles Carl Roberts, 32, shot 10 young girls in a one-room schoolhouse in Bart Township, killing 5, before taking his own life.",6,5,11,School,32,No,He told his wife that he'd molested two young relatives 20 years ago.,Yes,"Local stores in Nickel Mines, Penn. ","One semiautomatic handgun, one rifle, one shotgun",Springfield semiautomatic handgun; .30-06 Ruger bolt-action rifle; 12-gauge Browning pump-action shotgun,white,Male,"http://news.google.com/newspapers?id=O8oyAAAAIBAJ&sjid=YSUEAAAAIBAJ&pg=6143,1260138&dq=charles+carl+roberts+mentally+ill&hl=en;http://www.msnbc.msn.com/id/15105305/ns/us_news-crime_and_courts/t/th-girl-dies-after-amish-schoolhouse-shooting/#.UFD4SxhgspQ; http://www.foxnews.com/story/0,2933,217170,00.html",http://www.cnn.com/2006/US/10/03/amish.shooting/index.html,"http://news.google.com/newspapers?id=O8oyAAAAIBAJ&sjid=YSUEAAAAIBAJ&pg=6143,1260138&dq=charles+carl+roberts+mentally+ill&hl=en;http://www.msnbc.msn.com/id/15105305/ns/us_news-crime_and_courts/t/th-girl-dies-after-amish-schoolhouse-shooting/#.UFD4SxhgspQ; http://www.foxnews.com/story/0,2933,217170,00.html",39.9589,-76.0806,Mass,2006,"Lancaster County, Pennsylvania",12,Pennsylvania,High Umemployment,,Low Fatalities
Capitol Hill massacre,"Seattle, Washington",38801,"Kyle Aaron Huff, 28, opened fire at a rave afterparty in the Capitol Hill neighborhood of Seattle before committing suicide.",7,2,9,Other,28,No,Police were unable to find any record that he had been treated for mental illness or was on psychiatric medication.,Yes,"Various sporting goods stores in Kalispell, Mont.","Two semiautomatic handguns, one rifle (assault), one shotgun",".40-caliber Ruger, one other semiautomatic handgun; Bushmaster XM15 E2S semiautomatic rifle; 12-gauge Winchester Defender pump-action shotgun with extended tube and pistol grip",white,Male,http://seattletimes.com/html/localnews/2002892043_shooter27m.html; http://seattletimes.com/html/localnews/2002898900_huff30m.html,http://seattletimes.com/html/localnews/2002898900_huff30m.html,http://seattletimes.com/html/localnews/2002892043_shooter27m.html; http://seattletimes.com/html/localnews/2002898900_huff30m.html,47.6229,-122.3165,Mass,2006,"Seattle, Washington",10,Washington,High Umemployment,,Low Fatalities
Goleta postal shootings,"Goleta, California",38747,"Former postal worker Jennifer Sanmarco, 44, shot dead a former neighbor then drove to the mail processing plant where she used to work. Inside, she opened fire, killing six employees before committing suicide.",8,0,8,Workplace,44,Yes,She was placed on retirement disability for psychological reasons. Fellow employees described her behavior as increasingly bizarre. She believed the Postal Service employees were conspiring against her.,Yes,"Pawn shops in Grants and Gallup, N.M.",One semiautomatic handgun,9mm Smith & Wesson 915 semiautomatic handgun,white,Female,http://www.msnbc.msn.com/id/11167920/ns/us_news-crime_and_courts/t/postal-killer-believed-she-was-target-plot/#.UIxy7kzLwTE; http://www.cbsnews.com/stories/2006/02/02/national/main1272077.shtml;,http://www.msnbc.msn.com/id/11167920/ns/us_news-crime_and_courts/t/postal-killer-believed-she-was-target-plot/#.UNyN5cXhe75,http://www.msnbc.msn.com/id/11167920/ns/us_news-crime_and_courts/t/postal-killer-believed-she-was-target-plot/#.UIxy7kzLwTE; http://www.cbsnews.com/stories/2006/02/02/national/main1272077.shtml;,34.425571,-119.866069,Mass,2006,"Goleta, California",10,California,High Umemployment,,Low Fatalities
Red Lake massacre,"Red Lake, Minnesota",38432,"Jeffrey Weise, 16, murdered his grandfather, who was a police officer, and grandfather's girlfriend. Weise then drove his grandfather's squad car to Red Lake Senior High School and opened fire on the reservation campus, killing another seven people before committing suicide.",10,5,15,School,16,Yes,He voluntarily visited a a psychiatric ward. He was hospitalized at least once for suicidal tendencies and was taking Prozac.,No,Glock and Remington stolen from grandfather,"Two semiautomatic handguns, one shotgun",".40-caliber Glock 23, .22-caliber Ruger semiautomatic handguns; 12-gauge Remington 870 shotgun",Native American,Male,"http://news.google.com/newspapers?id=c4dIAAAAIBAJ&sjid=_XEDAAAAIBAJ&pg=5163,1527281&dq=jeffrey+weise+mental+ill&hl=en; http://www.cbsnews.com/stories/2005/03/24/national/main682915.shtml?source=search_story; http://www.usnews.com/usnews/news/articles/050404/4redlake.htm; http://www.foxnews.com/story/0,2933,151116,00.html",http://www.cbsnews.com/stories/2005/03/24/national/main682915.shtml?source=search_story,"http://news.google.com/newspapers?id=c4dIAAAAIBAJ&sjid=_XEDAAAAIBAJ&pg=5163,1527281&dq=jeffrey+weise+mental+ill&hl=en; http://www.cbsnews.com/stories/2005/03/24/national/main682915.shtml?source=search_story; http://www.usnews.com/usnews/news/articles/050404/4redlake.htm; http://www.foxnews.com/story/0,2933,151116,00.html",47.876346,-95.0169401,Mass,2005,"Red Lake, Minnesota",9,Minnesota,Low Unemployment,,More Fatalities
Living Church of God shooting,"Brookfield, Wisconsin",38423,"Living Church of God member Terry Michael Ratzmann, 44, opened fire at a church meeting at a Sheraton hotel before committing suicide.",7,4,11,Religious,44,Yes,Neighbors said he suffered from depression and had a drinking problem.,Yes,"Gun dealer in Waukesha, Wis.",One semiautomatic handgun,9mm Beretta semiautomatic handgun,white,Male,"http://www.cbsnews.com/2100-201_162-679761.html; http://www.foxnews.com/story/0,2933,150255,00.html; http://www.msnbc.msn.com/id/7167861/ns/us_news-crime_and_courts/t/relatives-struggle-answers-after-shooting/#.UN3Scko6JT4",http://www.cbsnews.com/2100-201_162-679761.html,"http://www.cbsnews.com/2100-201_162-679761.html; http://www.foxnews.com/story/0,2933,150255,00.html; http://www.msnbc.msn.com/id/7167861/ns/us_news-crime_and_courts/t/relatives-struggle-answers-after-shooting/#.UN3Scko6JT4",43.0605671,-88.1064787,Spree,2005,"Brookfield, Wisconsin",9,Wisconsin,Low Unemployment,,Low Fatalities
Damageplan show shooting,"Columbus, Ohio",38329,"Nathan Gale, 25, possibly upset about the breakup of Pantera, gunned down former Pantera guitarist Dimebag Darrell and three others at a Damageplan show before a police officer fatally shot Gale.",5,7,12,Other,25,Yes,He was discharged from the military because he was a paranoid schizophrenic.,Yes,Received as a gift from mother,One semiautomatic handgun,9mm Beretta 92FS semiautomatic handgun,white,Male,http://www.cbsnews.com/2100-201_162-659983.html; http://www.knac.com/article.asp?ArticleID=3417; http://www.blabbermouth.net/news.aspx?mode=Article&newsitemID=86362,http://www.cbsnews.com/2100-201_162-659983.html,http://www.cbsnews.com/2100-201_162-659983.html; http://www.knac.com/article.asp?ArticleID=3417; http://www.blabbermouth.net/news.aspx?mode=Article&newsitemID=86362,39.9622601,-83.0007065,Mass,2004,"Columbus, Ohio",4,Ohio,High Umemployment,,Low Fatalities
Lockheed Martin shooting,"Meridian, Mississippi",37810,"Assembly line worker Douglas Williams, 48, opened fire at his Lockheed Martin workplace in a racially motivated attack before committing suicide.",7,8,15,Workplace,48,Yes,"His cousin said he was depressed and ""going through a lot of things.""",Yes,Purchased from an individual,"One semiautomatic handgun, two rifles, one derringer, one shotgun",".45-caliber Ruger P90 semiautomatic handgun; .22-caliber rifle with scope, .223-caliber Ruger Mini-14 rifle; 12-gauge Winchester 1300 shotgun; .22 Magnum derringer",white,Male,http://usatoday30.usatoday.com/news/nation/2003-07-08-miss-shooting-main_x.htm; http://www.nytimes.com/2003/07/09/us/man-kills-5-co-workers-at-plant-and-himself.html; http://www.nytimes.com/2003/07/16/us/national-briefing-south-mississippi-death-toll-rises-in-plant-shooting.html,http://usatoday30.usatoday.com/news/nation/2003-07-08-miss-shooting-main_x.htm,http://usatoday30.usatoday.com/news/nation/2003-07-08-miss-shooting-main_x.htm; http://www.nytimes.com/2003/07/09/us/man-kills-5-co-workers-at-plant-and-himself.html; http://www.nytimes.com/2003/07/16/us/national-briefing-south-mississippi-death-toll-rises-in-plant-shooting.html,32.410842,-88.634539,Mass,2003,"Meridian, Mississippi",11,Mississippi,High Umemployment,,Low Fatalities
Navistar shooting,"Melrose Park, Illinois",36927,"Fired employee William D. Baker, 66, opened fire at his former Navistar workplace before committing suicide.",5,4,9,Workplace,66,No,"He had a criminal past, including a sexual assault conviction.",Yes,"Some purchased from Pepper Sports in Glen Ellyn, Ill. ","Two rifles, one revolver, one shotgun","SKS 1954R, .30-caliber Winchester rifles; 12-gauge Remington pump-action shotgun; .38-caliber revolver",black,Male,http://articles.chicagotribune.com/2001-02-07/news/0102070122_1_navistar-gun-law-hunting-rifle; http://www.vpc.org/studies/wgun010205.htm,http://articles.chicagotribune.com/2001-02-07/news/0102070122_1_navistar-gun-law-hunting-rifle,http://articles.chicagotribune.com/2001-02-07/news/0102070122_1_navistar-gun-law-hunting-rifle; http://www.vpc.org/studies/wgun010205.htm,41.908163,-87.879908,Mass,2001,"Melrose Park, Illinois",8,Illinois,High Umemployment,,Low Fatalities
Wakefield massacre,"Wakefield, Massachusetts",36886,"Michael McDermott, 42, opened fire on co-workers at Edgewater Technology and was later arrested.",7,0,7,Workplace,42,Yes,"Psychiatrist guessed he had schizophrenia, but McDermott had researched how to fake a mental illness on the internet. Defense lawyer described history of suicide attempts and mental illness dating back to teen years. Jury rejected his insanity defense. ",Yes,Unknown,"One semiautomatic handgun, one rifle (assault), one shotgun",.32-caliber Retolaza semiautomatic handgun; AK-47 variant semiautomatic rifle; 12-gauge Winchester 1300 pump-action shotgun,white,Male,"http://www.time.com/time/magazine/article/0,9171,93313,00.html; http://articles.cnn.com/2002-04-22/justice/ctv.mcdermott.trial_1_michael-mcdermott-jury-deliberates-fate-mental-illness?_s=PM:LAW; http://www.nytimes.com/2000/12/27/us/7-die-in-rampage-at-company-co-worker-of-victims-arrested.html; http://www.vpc.org/studies/wgun001226.htm",http://articles.cnn.com/2002-04-22/justice/ctv.mcdermott.trial_1_michael-mcdermott-jury-deliberates-fate-mental-illness?_s=PM:LAW; http://www.boston.com/news/daily/24/mcdermott_verdict.htm,"http://www.time.com/time/magazine/article/0,9171,93313,00.html; http://articles.cnn.com/2002-04-22/justice/ctv.mcdermott.trial_1_michael-mcdermott-jury-deliberates-fate-mental-illness?_s=PM:LAW; http://www.nytimes.com/2000/12/27/us/7-die-in-rampage-at-company-co-worker-of-victims-arrested.html; http://www.vpc.org/studies/wgun001226.htm",42.500429,-71.075913,Mass,2000,"Wakefield, Massachusetts",13,Massachusetts,Low Unemployment,,Low Fatalities
Hotel shooting,"Tampa, Florida",36524,"Hotel employee Silvio Leyva, 36, gunned down four coworkers at the Radisson Bay Harbor Inn before killing a woman outside who refused to give him her car. He was arrested shortly after the shootings.",5,3,8,Workplace,36,Yes,"His brother called him ""unbalanced"" and mentally ill.",Yes,"One purchased from Big E's in Tampa, Fla.","One semiautomatic handgun, one revolver",9mm Lorcin semiautomatic handgun; .38-caliber Charter Arms revolver,Latino,Male,"http://www.sptimes.com/News/123000/news_pf/TampaBay/A_year_later__the_str.shtml; http://www.vpc.org/studies/wgun991230.htm; http://news.google.com/newspapers?id=CSUdAAAAIBAJ&sjid=ZaYEAAAAIBAJ&pg=2043,2634069&dq=silvio+leyva+shooting&hl=en",http://www.sptimes.com/News/123000/news_pf/TampaBay/A_year_later__the_str.shtml,"http://www.sptimes.com/News/123000/news_pf/TampaBay/A_year_later__the_str.shtml; http://www.vpc.org/studies/wgun991230.htm; http://news.google.com/newspapers?id=CSUdAAAAIBAJ&sjid=ZaYEAAAAIBAJ&pg=2043,2634069&dq=silvio+leyva+shooting&hl=en",27.966479,-82.570586,Spree,1999,"Tampa, Florida",7,Florida,High Umemployment,,Low Fatalities
Xerox killings,"Honolulu, Hawaii",36466,"Byran Koji Uyesugi, 40, a Xerox service technician, opened fire inside the building with a 9mm Glock. He fled and was later apprehended by police.",7,0,7,Workplace,40,Yes," A psychiatrist, testifying for the prosecution,said he suffered from schizophrenia.",Yes,"Hunting Supplies of Hawaii (The Armory) in Honolulu, Hawaii",One semiautomatic handgun,9mm Glock 17 semiautomatic handgun,Asian,Male,http://archives.starbulletin.com/2000/06/02/news/story2.html; http://www.vpc.org/studies/wgun991102.htm,http://archives.starbulletin.com/2000/06/02/news/story2.html,http://archives.starbulletin.com/2000/06/02/news/story2.html; http://www.vpc.org/studies/wgun991102.htm,21.320063,-157.876462,Spree,1999,"Honolulu, Hawaii",6,Hawaii,Low Unemployment,,Low Fatalities
Wedgwood Baptist Church shooting,"Fort Worth, Texas",36418,"Larry Gene Ashbrook, 47, opened fire inside the Wedgwood Baptist Church during a prayer rally before committing suicide.",8,7,15,Religious,47,Yes,His siblings decribed him as a paranoid schizophrenic. ,Yes,"Trader's Village flea market in Grand Prairie, Texas",Two semiautomatic handguns,".380-caliber, 9mm Ruger P85 semiautomatic handguns",white,Male,http://www.nytimes.com/1999/09/20/us/fort-worth-remembers-those-killed-at-church.html?pagewanted=all&src=pm; http://www.nytimes.com/1999/09/18/us/death-in-a-church-the-overview-with-question-of-why-unanswered-fort-worth-mourns.html; http://www.vpc.org/studies/wgun990915.htm,http://www.nytimes.com/1999/09/18/us/death-in-a-church-the-overview-with-question-of-why-unanswered-fort-worth-mourns.html,http://www.nytimes.com/1999/09/20/us/fort-worth-remembers-those-killed-at-church.html?pagewanted=all&src=pm; http://www.nytimes.com/1999/09/18/us/death-in-a-church-the-overview-with-question-of-why-unanswered-fort-worth-mourns.html; http://www.vpc.org/studies/wgun990915.htm,32.664511,-97.384246,Mass,1999,"Fort Worth, Texas",5,Texas,High Umemployment,,Low Fatalities
Atlanta day trading spree killings,"Atlanta, Georgia",36370,"Day trader Mark O. Barton, 44, who had recently lost a substantial sum of money, went on a shooting spree through two day-trading firms. He started at the All-Tech Investment Group, where he worked, then went on to Momentum Securities. He fled and hours later, after being cornered by police outside a gas station, committed suicide. (Two days before the spree, he killed his wife and two children with a hammer.)",9,13,22,Workplace,44,Yes,"In letters, he details his deep depression and downward spiral. ",Yes,"Glock purchased from gun store in Warner Robins, Ga. ","Three semiautomatic handguns, one revolver",".45-caliber Colt 1911-A1, 9mm Glock 17, .25-caliber Raven Arms MP-25 semiautomatic handguns; .22-caliber Harrington & Richardson revolver",white,Male,http://www.independent.co.uk/news/i-dont-plan-to-live-much-longer-just-long-enough-to-kill-the-people-that-greedily-sought-my-destruction-1109610.html; http://articles.cnn.com/1999-07-30/us/9907_30_atlanta.shooting.06_1_gladys-barton-debra-spivey-barton-note?_s=PM:US; http://www.vpc.org/studies/wgun990729.htm,http://www.independent.co.uk/news/i-dont-plan-to-live-much-longer-just-long-enough-to-kill-the-people-that-greedily-sought-my-destruction-1109610.html,http://www.independent.co.uk/news/i-dont-plan-to-live-much-longer-just-long-enough-to-kill-the-people-that-greedily-sought-my-destruction-1109610.html; http://articles.cnn.com/1999-07-30/us/9907_30_atlanta.shooting.06_1_gladys-barton-debra-spivey-barton-note?_s=PM:US; http://www.vpc.org/studies/wgun990729.htm,33.850116,-84.377839,Mass,1999,"Atlanta, Georgia",7,Georgia,High Umemployment,,More Fatalities
Columbine High School massacre,"Littleton, Colorado",36270,"Eric Harris, 18, and Dylan Klebold, 17, opened fire throughout Columbine High School before committing suicide.",13,24,37,School,17,Yes,Harris was an alleged psychopath; Klebold was depressed and suicidal.,No,"Purchased variously at Tanner Gun Show in Denver, Colo. and from an individual","One semiautomatic handgun (assault), one rifle (assault), two shotguns","9mm Intratec DC-9 semiautomatic handgun; 9mm Hi-Point 995 carbine rifle; 12-gauge sawed-off Savage Stevens 311D, 12-gauge sawed-off Savage Springfield 67H pump-action shotguns",white,Male,http://www.usatoday.com/news/nation/2009-04-13-columbine-myths_N.htm; http://www.vpc.org/studies/wgun990420.htm; http://www.slate.com/articles/news_and_politics/assessment/2004/04/the_depressive_and_the_psychopath.html,http://www.slate.com/articles/news_and_politics/assessment/2004/04/the_depressive_and_the_psychopath.html,http://www.usatoday.com/news/nation/2009-04-13-columbine-myths_N.htm; http://www.vpc.org/studies/wgun990420.htm; http://www.slate.com/articles/news_and_politics/assessment/2004/04/the_depressive_and_the_psychopath.html,39.604034,-105.074103,Mass,1999,"Littleton, Colorado",8,Colorado,Low Unemployment,,More Fatalities
Thurston High School shooting,"Springfield, Oregon",35936,"After he was expelled for having a gun in his locker, Kipland P. Kinkel, 15, a freshman at Thurston High, went on a shooting spree, killing his parents at home and two students at school. Five classmates wrestled Kipland to the ground before he was arrested.",4,25,29,School,15,Yes,Doctors testified that he was a paranoid schizophrenic who suffered from hallucinations,No,"Purchased variously from friend and father, and stolen from father","Two semiautomatic handguns, one rifle","9mm Glock, .22-caliber Ruger semiautomatic handguns, .22-caliber Ruger rifle",white,Male,http://www.katu.com/news/local/8082147.html; http://www.pbs.org/wgbh/pages/frontline/shows/kinkel/kip/cron.html; http://www.oregonlive.com/special/index.ssf/2008/05/the_suspect_kipland_kinkels_da.html; http://articles.cnn.com/2000-01-21/us/kinkel.revisited_1_kip-kinkel-thurston-high-school-oregon-school-shooting?_s=PM:US,http://articles.cnn.com/2000-01-21/us/kinkel.revisited_1_kip-kinkel-thurston-high-school-oregon-school-shooting?_s=PM:US,http://www.katu.com/news/local/8082147.html; http://www.pbs.org/wgbh/pages/frontline/shows/kinkel/kip/cron.html; http://www.oregonlive.com/special/index.ssf/2008/05/the_suspect_kipland_kinkels_da.html; http://articles.cnn.com/2000-01-21/us/kinkel.revisited_1_kip-kinkel-thurston-high-school-oregon-school-shooting?_s=PM:US,44.0462362,-123.0220289,Mass,1998,"Springfield, Oregon",6,Oregon,High Umemployment,,Low Fatalities
Westside Middle School killings,"Jonesboro, Arkansas",35878,"Mitchell Scott Johnson, 13, and Andrew Douglas Golden, 11, two juveniles, ambushed students and teachers as they left the school; they were apprehended by police at the scene.",5,10,15,School,11,No,Boys displayed unruly and aggressive behavior. They picked on kids and made threats about killing people. ,No,Stolen from grandfather and father,"Two semiautomatic handguns, two rifles, three revolvers, two derringers","FIE 380, .380-caliber Star semiautomatic handguns; .44 Magnum Ruger, .30-06 Remington 742, .30-caliber Universal M-1 carbine replica rifles; .38-caliber Charter Arms, .357-caliber Ruger Security Six, .38-caliber Smith & Wesson revolvers; .22-caliber Double Deuce Buddie two-shot, .38-caliber Davis Industries two-shot derringers",white,Male,http://www.vpc.org/studies/wgun980324.htm,http://www.nytimes.com/1998/03/29/us/from-wild-talk-and-friendship-to-five-deaths-in-a-schoolyard.html?sec=&spon=&pagewanted=all,http://www.vpc.org/studies/wgun980324.htm; https://www.nytimes.com/1998/04/18/us/jonesboro-dazed-by-its-darkest-day.html,35.8209895,-90.6682606,Mass,1998,"Jonesboro, Arkansas",8,Arkansas,High Umemployment,,Low Fatalities
Connecticut Lottery shooting,"Newington, Connecticut",35860,"Lottery worker Matthew Beck, 35, gunned down four bosses over a salary dispute before committing suicide.",5,1,6,Workplace,35,Yes,He had been hospitalized for psychiatric reasons and had a history of depression,Yes,Unknown,One semiautomatic handgun,9mm semiautomatic handgun,white,Male,http://www.nytimes.com/1998/03/07/nyregion/rampage-connecticut-overview-connecticut-lottery-worker-kills-4-bosses-then.html?pagewanted=all&src=pm; http://www.nytimes.com/2000/04/11/us/hole-in-gun-control-law-lets-mentally-ill-through.html?pagewanted=all&src=pm,http://www.nytimes.com/2000/04/11/us/hole-in-gun-control-law-lets-mentally-ill-through.html?pagewanted=all&src=pm,http://www.nytimes.com/1998/03/07/nyregion/rampage-connecticut-overview-connecticut-lottery-worker-kills-4-bosses-then.html?pagewanted=all&src=pm; http://www.nytimes.com/2000/04/11/us/hole-in-gun-control-law-lets-mentally-ill-through.html?pagewanted=all&src=pm,41.6856325,-72.72983827,Mass,1998,"Newington, Connecticut",11,Connecticut,Low Unemployment,,Low Fatalities
Caltrans maintenance yard shooting,"Orange, California",35782,"Former Caltrans employee Arturo Reyes Torres, 41, opened fire at a maintenance yard after he was fired for allegedly selling government materials he'd stolen from work. He was shot dead by police.",5,2,7,Workplace,41,No,He was disgruntled after being fired. ,Yes,"B&B Gun Sales in Orange County, Calif.",One rifle (assault),7.62mm AK-47 Chinese variant semiautomatic rifle,Latino,Male,"http://articles.latimes.com/1997/dec/20/news/mn-431; http://articles.latimes.com/1997/dec/22/local/me-1156; http://www.vpc.org/studies/wgun971218.htm; http://news.google.com/newspapers?id=DitZAAAAIBAJ&sjid=LEcNAAAAIBAJ&pg=6705,2243998&dq=arturo+reyes+torres+caltrans&hl=en",http://articles.latimes.com/1997/dec/20/news/mn-431,"http://articles.latimes.com/1997/dec/20/news/mn-431; http://articles.latimes.com/1997/dec/22/local/me-1156; http://www.vpc.org/studies/wgun971218.htm; http://news.google.com/newspapers?id=DitZAAAAIBAJ&sjid=LEcNAAAAIBAJ&pg=6705,2243998&dq=arturo+reyes+torres+caltrans&hl=en",33.7877944,-117.8531119,Spree,1997,"Orange, California",10,California,High Umemployment,,Low Fatalities
R.E. Phelon Company shooting,"Aiken, South Carolina",35688,"Ex-con Hastings Arthur Wise, 43, opened fire at the R.E. Phelon Company in retaliation for being fired after an argument with a supervisor. He attempted suicide by ingesting insecticide, failed, and was executed by the state of South Carolina eight years later.",4,3,7,Workplace,43,No,"An ex-con, he had been freed from prison, although he displayed violent tendencies.",No,Unknown,One semiautomatic handgun,9mm semiautomatic handgun,black,Male,http://www.vpc.org/studies/wgun970915.htm; http://chronicle.augusta.com/stories/1997/09/18/met_214833.shtml,http://chronicle.augusta.com/stories/1997/09/18/met_214833.shtml,http://www.vpc.org/studies/wgun970915.htm; http://chronicle.augusta.com/stories/1997/09/18/met_214833.shtml,33.5598586,-81.721952,Mass,1997,"Aiken, South Carolina",14,South Carolina,High Umemployment,,Low Fatalities
Fort Lauderdale revenge shooting,"Fort Lauderdale, Florida",35104,"Fired city park employee Clifton McCree, 41, opened fire on former coworkers he called ""racist devils"" inside their municipal trailer in an act of revenge after failing a drug test. He then committed suicide.",6,1,7,Workplace,41,Yes,"Co-workers complained about his threats and verbal abuse. His supervisors asked him to get a psychiatric evaluation. He lost his job, which relatives said drove his depression.",Yes,Unknown,"One semiautomatic handgun, one revolver",9mm Glock semiautomatic handgun; .32-caliber revolver,black,Male,http://www.nytimes.com/1996/02/11/us/florida-killer-said-victims-were-racists-police-say.html; http://articles.sun-sentinel.com/1996-02-10/news/9602090635_1_million-firearms-multiple-guns-reloading,http://articles.sun-sentinel.com/1996-02-11/news/9602110026_1_beach-crew-maintenance-fort-lauderdale,http://www.nytimes.com/1996/02/11/us/florida-killer-said-victims-were-racists-police-say.html; http://articles.sun-sentinel.com/1996-02-10/news/9602090635_1_million-firearms-multiple-guns-reloading,26.119269,-80.104119,Spree,1996,"Fort Lauderdale, Florida",7,Florida,High Umemployment,,Low Fatalities
Walter Rossler Company massacre,"Corpus Christi, Texas",34792,"Disgruntled former metallurgist James Daniel Simpson, 28, opened fire throughout the Walter Rossler Company where he had worked before exiting the building and committing suicide.",6,0,6,Workplace,28,No,He was likely angry because he was given an assignment at work he didn't like. But acquaintances didn't know why he'd come back and kill.,Yes,Unknown,"One semiautomatic handgun, one revolver",9mm Ruger semiautomatic handgun; .32-caliber revolver,unclear,Male,http://web.caller.com/2000/april/03/today/local_ne/4127.html,http://web.caller.com/2000/april/03/today/local_ne/4127.html,http://web.caller.com/2000/april/03/today/local_ne/4127.html,27.828025,-97.548198,Mass,1995,"Corpus Christi, Texas",5,Texas,High Umemployment,,Low Fatalities
