case,location,date,summary,fatalities,injured,total_victims,location,age_of_shooter,prior_signs_mental_health_issues,mental_health_details,legal_weapon,where_obtained,weapon_type,weapon_details,race,gender,sources,mental_health_sources,sources_additional_age,latitude,longitude,type,year,Place,,State,Hist_Unemp_St,,Fatality Status
FedEx warehouse shooting,"Indianapolis, Indiana",44301,"Brandon Scott Hole, 19, opened fire around 11 p.m. in the parking lot and inside the warehouse, and then shot himself fatally as police responded to the scene.",8,7,15,Workplace,19,Yes,Perpetrator had been reported to police in 2020 by his mother as potentially suicidal; he was detained by authorities on a temporary mental health hold,Yes,-,semiautomatic rifle,-,White,M,https://www.indystar.com/story/news/crime/2021/04/16/indianapolis-fedex-shooting-gunman-parked-car-and-began-randomly-firing-police-say/7251130002/; https://www.washingtonpost.com/nation/2021/04/16/indianapolis-fedex-shooting-airport/; https://apnews.com/article/fedex-indianapolis-mass-shooting-e92ad3117c56357b3b2c71a2903e68a8; https://www.nytimes.com/2021/04/19/us/indianapolis-shooting-red-flag-law.html,https://www.nytimes.com/2021/04/19/us/indianapolis-shooting-red-flag-law.html,-,39.68663,-86.32313,Mass,2021,"Indianapolis, Indiana",7,Indiana,High Umemployment,,Low Fatalities
Boulder supermarket shooting,"Boulder, Colorado",44277,"Ahmad Al Aliwi Alissa, 21, carried out a mass shooting at a King Soopers that left 10 victims dead, including veteran police officer Eric Talley, who was the first officer to respond on the scene. Alissa was wounded by police and taken into custody.",10,0,10,Workplace,21,Yes,Brother described him as paranoid; multiple accounts of anger issues from others who knew him. Misdemeanor criminal record for a violent assault during his senior year in high school.,Yes,-,"semiautomatic rifle, semiautomatic handgun; tactical vest",Ruger AR-556; weapon was purchased six days before the attack,-,M,https://www.denverpost.com/2021/03/22/police-active-shooter-shooting-king-soopers-boulder/; https://www.cnn.com/2021/03/23/us/boulder-colorado-shooting-suspect/index.html; https://www.nbcnews.com/news/us-news/man-charged-10-counts-first-degree-murder-after-shooting-colorado-n1261808; https://www.latimes.com/world-nation/story/2021-03-22/police-responding-to-active-shooter-at-colorado-supermarket; https://denver.cbslocal.com/2021/03/25/grocery-store-shooting-who-is-ahmad-al-issa-ahmad-al-aliwi-alissa/; https://www.nytimes.com/2021/03/27/us/boulder-gunman-alissa.html,https://www.thedailybeast.com/boulder-colorado-cops-identify-king-soopers-supermarket-massacre-suspect-as-ahmad-alissa,-,39.986961,-105.251168,Mass,2021,"Boulder, Colorado",8,Colorado,Low Unemployment,,More Fatalities
Harry Pratt Co. warehouse shooting,"Aurora, Illinois",43511,"Gary Martin, 45, went on a rampage inside the warehouse in response to being fired from his job and died soon thereafter in a shootout with police. Among his victims were five dead coworkers and five injured police officers. Martin had a felony record and lengthy history of domestic violence; he was able to obtain a gun despite having had his Illinois firearms ownership identification card revoked. According to a report from prosecutors, Martin told a co-worker the morning of the shooting that if he was fired he was going to kill employees and police.",5,6,11,Workplace,45,Yes,(pending),No,-,handgun,"Smith & Wesson handgun, with a green sighting laser",Black,M,https://www.washingtonpost.com/nation/2019/02/16/man-kills-five-warehouse-shooting-spree-shortly-after-being-fired-illinois-police-say/?utm_term=.9863ec4ffc41; https://www.cnn.com/2019/02/17/us/aurora-shooting-termination/index.html; https://www.wsj.com/articles/companies-roll-out-gunshot-detectors-at-the-office-11550575801; https://www.cbsnews.com/news/gary-martin-aurora-illinois-plant-gunman-threatened-violence-if-fired-prosecutors-say/,-,-,41.753725,-88.331057,Mass,2019,"Aurora, Illinois",8,Illinois,High Umemployment,,Low Fatalities
SunTrust bank shooting,"Sebring, Florida",43488,"Zephen A. Xaver, 21, fatally shot five women inside a bank and then called the police to confess. He was armed with a handgun and wore a bulletproof vest. He reportedly ordered the women to lie down on the floor and shot them execution-style. After a standoff with police, he surrendered and was taken into custody. A week prior, Xaver had quit a job as a prison guard trainee, and authorities said they believed the shooting was ""a random act"" and that roberry did not appear to be a motive. An ex-girlfriend in Indiana told local media she'd been “scared for years” by Xaver’s talk of violence and death, but that her warnings to others (who she did not identify) were not taken seriously. She said she’d first met Xaver in a psychiatric hospital in 2013. In March 2017, Michigan State Police documented an incident in which Xaver indicated he was “possibly thinking of suicide by cop and taking hostages.""",5,0,5,Workplace,21,Yes,Xaver was reported to have a lenghty history of expressing violent desires; an ex-girlfriend said she first met him at a psychiatric hospital in 2013.,Yes,-,handgun,9 mm handgun,White,M,https://wsbt.com/news/local/classmate-says-florida-bank-shooter-who-allegedly-killed-5-attended-bremen-high-school; https://www.washingtonpost.com/nation/2019/01/23/several-people-shot-after-gunman-barricades-himself-florida-bank-authorities-say/; https://www.wptv.com/news/state/accused-bank-shooter-zephen-xaver-fascinated-with-violence-ex-girlfriend-says; https://www.npr.org/2019/01/24/688183605/man-charged-with-murder-after-allegedly-killing-5-women-at-suntrust-bank-in-flor; https://www.wesh.com/article/sebring-bank-shooting-latest/26012533; https://www.apnews.com/c3523d282b2942739240731daaf797c2,https://wsbt.com/news/local/classmate-says-florida-bank-shooter-who-allegedly-killed-5-attended-bremen-high-school; https://www.washingtonpost.com/nation/2019/01/23/several-people-shot-after-gunman-barricades-himself-florida-bank-authorities-say/,-,27.471043,-81.45847,Mass,2019,"Sebring, Florida",7,Florida,High Umemployment,,Low Fatalities
Thousand Oaks nightclub shooting,"Thousand Oaks, California",43411,"Ian David Long, 28, dressed in black and armed with a handgun and a “smoke device,” approached the Borderline Bar & Grill — a country music venue popular with college students — close to midnight and opened fire, killing a security guard and then others in the club, including a sheriff’s deputy responding to the attack. Long was found dead at the scene from apparent suicide. He was a former Marine and had a history of interactions with local law enforcement, including a mental health evaluation in which he’d been cleared.",12,22,34,Other,28,Yes,"Per the LATimes: ""Sheriff Geoff Dean said his department had had several interactions with Long, including a call to his home in April for a complaint of disturbing the peace. Deputies at the time said Long was irate and acting irrationally, Dean said. They called in mental health professionals to evaluate him, and they concluded he did not need to be taken into custody.""",Yes,A gun store in Simi Valley,semiautomatic handgun,"Glock 21, .45 caliber; high-capacity magazine",-,M,http://www.latimes.com/local/lanow/la-me-ln-thousand-oaks-20181107-story.html; https://www.washingtonpost.com/nation/2018/11/08/multiple-injuries-reported-bar-shooting-thousand-oaks-calif/; https://www.nytimes.com/2018/11/08/us/shooting-california-thousand-oaks.html; https://www.nytimes.com/2018/11/08/us/ian-david-long-california-shooter.html; https://www.wsj.com/articles/multiple-injuries-reported-in-bar-shooting-in-thousand-oaks-california-1541666907,http://www.latimes.com/local/lanow/la-me-ln-thousand-oaks-20181107-story.html,-,34.176946,-118.874793,Mass,2018,"Thousand Oaks, California",10,California,High Umemployment,,More Fatalities
Fifth Third Center shooting,"Cincinnati, Ohio",43349,"Omar Enrique Santa Perez, 29, walked into the ground-floor lobby of a building in downtown Cincinnati shortly after 9 a.m. and opened fire. Within minutes, Perez was fatally wounded in a shootout with law enforcement officers responding to the scene.",3,2,5,Workplace,29,Yes,"Perez filed a ""delusional"" lawsuit in 2017 against CNBC and TD Ameritrade; the federal judge who threw out the case said Perez's allegations were ""rambling, difficult to decpipher and borders on delusional.""",Yes,A local gun store,semiautomatic handgun,9mm handgun,Latino,M,https://www.cnn.com/2018/09/07/us/cincinnati-shooting/index.html; https://www.cincinnati.com/story/news/crime/crime-and-courts/2018/09/06/omar-santa-perez-cincinnati-shooter-filed-lawsuit-against-cnbc/1217643002/; https://www.cincinnati.com/story/news/2018/09/07/cincinnati-shooting-what-we-know-suspect/1221725002/; https://www.cincinnati.com/story/news/2018/09/06/cincinnati-shooting-suspect-arrested-south-carolina-2014/1218729002/; https://www.cincinnati.com/story/news/crime/2018/09/07/why-cincinnati-shooter-allowed-have-gun/1221091002/,-,-,39.101981,-84.511782,Mass,2018,"Cincinnati, Ohio",4,Ohio,High Umemployment,,Low Fatalities
Waffle House shooting,"Nashville, Tennessee",43212,"Travis Reinking, 29, opened fire around 3:30 a.m. in the parking lot of a Waffle House in Antioch, and continued shooting as he entered the restaurant. As he attempted to reload his AR-15, a bystander heroically wrestled the rifle away from Reinking, who then fled; he was captured by authorities the following day. Reinking had a history of erratic behavior and run-ins with law enforcement in his home state of Illinois, including claims that he was being stalked and harassed by pop star Taylor Swift. In July 2017, he was arrested at the White House after breaching security in an effort to speak with President Trump, reportedly claiming his right to do so as “a sovereign citizen.”",4,4,8,Other,29,Yes,"Reinking had a history of erratic behavior and run-ins with law enforcement in his home state of Illinois, including claims that he was being stalked and harassed by pop star Taylor Swift. In July 2017, he was arrested at the White House after breaching security in an effort to speak with President Trump, reportedly claiming his right to do so as “a sovereign citizen.”",Yes,Family member,semiautomatic rifle,AR-15,White,M,https://www.washingtonpost.com/news/post-nation/wp/2018/04/23/waffle-house-shooting-travis-reinking-manhunt-continues-nashville-police-say/?utm_term=.69579db5fdc6; https://www.tennessean.com/story/news/2018/04/23/waffle-house-shooting-travis-reinking-search-continues-antioch-nashville/541313002/; https://www.nytimes.com/2018/04/23/us/waffle-house-shooting-nashville.html; https://www.buzzfeed.com/briannasacks/this-is-what-we-know-about-the-suspected-waffle-house-gunman?utm_term=.ilj2Knad6#.lklzyb3vj; http://www.wkrn.com/news/manhunt-continues-for-gunman-who-killed-4-at-antioch-waffle-house/1134986998,https://www.buzzfeed.com/briannasacks/this-is-what-we-know-about-the-suspected-waffle-house-gunman?utm_term=.ilj2Knad6#.lklzyb3vj,https://www.washingtonpost.com/news/post-nation/wp/2018/04/23/waffle-house-shooting-travis-reinking-manhunt-continues-nashville-police-say/?utm_term=.69579db5fdc6; https://www.tennessean.com/story/news/2018/04/23/waffle-house-shooting-travis-reinking-search-continues-antioch-nashville/541313002/; https://www.nytimes.com/2018/04/23/us/waffle-house-shooting-nashville.html; https://www.buzzfeed.com/briannasacks/this-is-what-we-know-about-the-suspected-waffle-house-gunman?utm_term=.ilj2Knad6#.lklzyb3vj; http://www.wkrn.com/news/manhunt-continues-for-gunman-who-killed-4-at-antioch-waffle-house/1134986998,36.052521,-86.616944,Mass,2018,"Nashville, Tennessee",9,Tennessee,High Umemployment,,Low Fatalities
Yountville veterans home shooting,"Yountville, California",43168,"Army veteran Albert Cheung Wong, 36, stormed a veterans home where he was previously under care, exchanging gunfire with a sheriff’s deputy and taking three women hostage, one of whom he’d previously threatened. After a standoff with law enforcement, he killed the three women and himself.",3,0,3,Workplace,36,Yes,Wong had served in Afghanistan and had a history of PTSD.,Yes,TBD,semiautomatic rifle; shotgun,-,Asian,M,https://www.cnn.com/2018/03/10/us/california-veterans-home-shooting/index.html; http://www.ktvu.com/news/gunman-in-yountville-veterans-home-killings-was-ex-patient; https://www.washingtonpost.com/news/post-nation/wp/2018/03/09/police-respond-to-reports-of-gunfire-and-hostages-taken-at-california-veterans-home/?utm_term=.b9dde7ac5f0f,https://www.cnn.com/2018/03/10/us/california-veterans-home-shooting/index.html,https://www.cnn.com/2018/03/10/us/california-veterans-home-shooting/index.html; http://www.ktvu.com/news/gunman-in-yountville-veterans-home-killings-was-ex-patient; https://www.washingtonpost.com/news/post-nation/wp/2018/03/09/police-respond-to-reports-of-gunfire-and-hostages-taken-at-california-veterans-home/?utm_term=.b9dde7ac5f0f,38.392496,-122.366528,Mass,2018,"Yountville, California",10,California,High Umemployment,,Low Fatalities
Marjory Stoneman Douglas High School shooting,"Parkland, Florida",43145,"Nikolas J. Cruz, 19, heavily armed with an AR-15, tactical gear, and “countless magazines” of ammo, according to the Broward County Sheriff, attacked the high school as classes were ending for the day, killing at least 17 people and injuring many others. He was apprehended by authorities shortly after fleeing the campus.",17,17,34,School,19,Yes,Cruz had a long history of behavioral problems and had spent time in mental health clinics.,Yes,A Florida pawn shop,semiautomatic rifle,AR-15,White,M,https://www.nytimes.com/2018/02/14/us/parkland-school-shooting.html; https://www.nytimes.com/2018/02/15/us/nikolas-cruz-florida-shooting.html; https://www.washingtonpost.com/news/local/wp/2019/01/25/feature/brother-parkland-shooter-nikolas-cruz/?utm_term=.1cc1aa9bb21a,https://www.nytimes.com/2018/02/15/us/nikolas-cruz-florida-shooting.html,https://www.nytimes.com/2018/02/14/us/parkland-school-shooting.html; https://www.nytimes.com/2018/02/15/us/nikolas-cruz-florida-shooting.html,26.30483,-80.269511,Mass,2018,"Parkland, Florida",7,Florida,High Umemployment,,More Fatalities
San Francisco UPS shooting,"San Francisco, California",42900,"Jimmy Lam, 38, fatally shot three coworkers and wounded two others inside a UPS facility in San Francisco. Lam killed himself as law enforcement officers responded to the scene.",3,2,5,Workplace,38,Yes,"Lam had a history of domestic, work conflict",No,Unclear; the firearm was stolen in Utah. A second handgun Lam had (also stolen) was unused in the attack.,two handguns,MAC-10-style “assault pistol”; 30-round magazine. An additional box of ammunition.,Asian,M,http://www.nbcbayarea.com/news/local/Active-Shooter-San-Francisco-Police-428441423.html; https://apnews.com/2c1690393510447995018b0f9467b44c?utm_campaign=SocialFlow&utm_source=Twitter&utm_medium=AP; http://www.sfchronicle.com/bayarea/article/Police-swarm-UPS-building-in-SF-on-report-of-11219519.php; https://www.pressroom.ups.com/pressroom/ContentDetailsViewer.page?ConceptType=PressReleases&id=1497461182413-836; http://www.foxnews.com/us/2017/06/15/san-francisco-ups-facility-shooting-gunman-identified-as-police-seek-motive.html; http://www.sfgate.com/crime/article/UPS-shooter-in-San-Francisco-used-stolen-gun-with-11243414.php,http://www.ktvu.com/news/ktvu-local-news/261771610-story; https://twitter.com/LauraGarciaCann/status/875072768471117824; http://heavy.com/news/2017/06/jimmy-lam-ups-san-francisco-shooting-suspect/; http://heavy.com/news/2017/06/jimmy-lam-ups-san-francisco-shooting-suspect/,http://www.nbcbayarea.com/news/local/Active-Shooter-San-Francisco-Police-428441423.html; https://apnews.com/2c1690393510447995018b0f9467b44c?utm_campaign=SocialFlow&utm_source=Twitter&utm_medium=AP; http://www.sfchronicle.com/bayarea/article/Police-swarm-UPS-building-in-SF-on-report-of-11219519.php; https://www.pressroom.ups.com/pressroom/ContentDetailsViewer.page?ConceptType=PressReleases&id=1497461182413-836; http://www.foxnews.com/us/2017/06/15/san-francisco-ups-facility-shooting-gunman-identified-as-police-seek-motive.html; http://www.sfgate.com/crime/article/UPS-shooter-in-San-Francisco-used-stolen-gun-with-11243414.php,37.765947,-122.406087,Mass,2017,"San Francisco, California",10,California,High Umemployment,,Low Fatalities
Fort Lauderdale airport shooting,"Fort Lauderdale, Florida",42741,"Esteban Santiago, 26, flew from Alaska to Fort Lauderdale, where he opened fire in the baggage claim area of the airport, killing five and wounding six before police aprehended him. (Numerous other people were reportedly injured while fleeing during the panic.)",5,6,11,Airport,26,Yes,"Among other signs, Santiago had gone to a FBI office in Anchorage and complained that his mind was being controlled by the CIA.",Yes,-,"semiautomatic handgun
",Walther 9mm semi-automatic pistol[,Latino,M,http://www.nytimes.com/2017/01/07/us/esteban-santiago-fort-lauderdale-airport-shooting-.html?_r=0,http://www.nytimes.com/2017/01/07/us/esteban-santiago-fort-lauderdale-airport-shooting-.html?_r=0,http://www.nytimes.com/2017/01/07/us/esteban-santiago-fort-lauderdale-airport-shooting-.html?_r=0,26.072751,-80.143382,Mass,2017,"Fort Lauderdale, Florida",7,Florida,High Umemployment,,Low Fatalities
Trestle Trail bridge shooting,"Menasha, Wisconsin",42166,"Sergio Valencia del Toro, 27, in what officials say was a random act, shot and killed three people including an 11-year-old girl before turning the gun on himself.",3,1,4,Other,27,Yes,"While serving in the Air Force, he went to an emergency walk-in clinic because of concerns over his mood swings, and had either sought or been ordered to behavioral health interventions, according to Fox 6 Now. In a 2014 risk assessment with a psychologist at an outpatient clinic in Appleton, Valencia del Toro recalled thinking previously: ""If I'm gonna take myself out, I might as well take other people with me."" The police report obtained by Fox 6 says that Valencia del Toro had a history of depression, suicidal and occassionally homicidal thoughts, and alcoholism. He was intoxicated on the day of the shooting.",Yes,Unclear,"Two handguns
","Details unclear, but after the shooting, police found eight guns in total in Valencia del Toro's home, including handguns, shotguns, and rifles, plus and more than 1,000 rounds of ammunition. He took two weapons and ammunition to the bridge.",Latino,M,http://fox6now.com/2015/06/11/released-menasha-police-issue-final-report-on-trestle-trail-bridge-shooting/ and http://www.postcrescent.com/story/news/local/2015/06/11/police-gunman-prior-suicidal-homicidal-thoughts/71064874/ and http://fox6now.com/2015/05/05/he-was-my-future-husband-fiancee-of-menasha-gunman-says-shes-devastated-for-victims-families/,-,http://fox6now.com/2015/06/11/released-menasha-police-issue-final-report-on-trestle-trail-bridge-shooting/ and http://www.postcrescent.com/story/news/local/2015/06/11/police-gunman-prior-suicidal-homicidal-thoughts/71064874/ and http://fox6now.com/2015/05/05/he-was-my-future-husband-fiancee-of-menasha-gunman-says-shes-devastated-for-victims-families/,44.204124,-88.467541,Mass,2015,"Menasha, Wisconsin",9,Wisconsin,Low Unemployment,,Low Fatalities
Isla Vista mass murder,"Santa Barbara, California",41782,"Elliot Rodger, 22, shot three people to death in the college town of Isla Vista near the University of California, Santa Barbara. He also shot others as he drove around town, and injured others by striking them with is vehicle. He committed suicide by shooting himself in his car as police closed in. Prior to the rampage, Rodger stabbed three people to death at his apartment.",6,13,19,School,22,Yes,"Rodger was never hospitalized due to mental illness, but had a long history of mental health issues dating back to his childhood, and received treatment from multiple counselors leading up to his rampage. According to The Independent, Rodger had considered suicide but had no history of violence. Just before his rampage, he sent a 137-page manifesto to multiple people.",Yes,-,Three semi-automatic handguns and two hunting knives,"Two Sig Sauer P226 semiautomatic pistols and Glock 34 pistol, and hundreds of rounds of ammo. A 6- inchand 8-inch “SRK” and “Boar Hunter” hunting knives.",White,M,http://www.sbsheriff.us/documents/ISLAVISTAINVESTIGATIVESUMMARY.pdf Also: http://www.cnn.com/2014/05/24/us/santa-barbara-isla-vista-shooting-profile/ and http://www.cnn.com/2014/05/24/justice/california-shooting-deaths/index.html and http://www.independent.com/news/2015/feb/20/elliot-rodger-report-details-long-struggle-mental-/ and http://www.cbsnews.com/videos/how-was-elliot-rodger-able-to-purchase-weapons/ and http://www.dailymail.co.uk/news/article-2638922/Santa-Barbara-rampage-killer-bought-three-handguns-legally-gun-shop.html,-,http://www.sbsheriff.us/documents/ISLAVISTAINVESTIGATIVESUMMARY.pdf Also: http://www.cnn.com/2014/05/24/us/santa-barbara-isla-vista-shooting-profile/ and http://www.cnn.com/2014/05/24/justice/california-shooting-deaths/index.html and http://www.independent.com/news/2015/feb/20/elliot-rodger-report-details-long-struggle-mental-/ and http://www.cbsnews.com/videos/how-was-elliot-rodger-able-to-purchase-weapons/ and http://www.dailymail.co.uk/news/article-2638922/Santa-Barbara-rampage-killer-bought-three-handguns-legally-gun-shop.html,34.436283,-119.8714406,Mass,2014,"Santa Barbara, California",10,California,High Umemployment,,Low Fatalities
Washington Navy Yard shooting,"Washington, D.C.",41533,"Aaron Alexis, 34, a military veteran and contractor from Texas, opened fire in the Navy installation, killing 12 people and wounding 8 before being shot dead by police.",12,8,20,Military,34,Yes,"Had told Rhode Island police the prior month that he'd ""heard voices""; had been undergoing mental health treatment with Veterans Affairs since August 2013.",Yes,Sharpshooters Small Arms Range,"Sawed-off shotgun, 2 boxes of shells; also a .45-caliber handgun taken from a security guard he shot at the scene.",Remington 870 Express 12-gauge shotgun; Beretta handgun,Black,Male,http://www.nytimes.com/2013/09/18/us/state-law-stopped-gunman-from-buying-rifle-officials-say.html; http://edition.cnn.com/2013/09/17/us/navy-yard-shooting-military-contractors; http://www.fbi.gov/washingtondc/press-releases/2013/law-enforcement-shares-findings-of-the-investigation-into-the-washington-navy-yard-shootings/index.html,http://bigstory.ap.org/article/13-killed-washington-navy-yard-shooting-rampage,http://www.nytimes.com/2013/09/18/us/state-law-stopped-gunman-from-buying-rifle-officials-say.html; http://edition.cnn.com/2013/09/17/us/navy-yard-shooting-military-contractors; http://www.fbi.gov/washingtondc/press-releases/2013/law-enforcement-shares-findings-of-the-investigation-into-the-washington-navy-yard-shootings/index.html,38.874981,-76.99453,Mass,2013,"Washington, D.C.",4,D.C.,Low Unemployment,,More Fatalities
Santa Monica rampage,"Santa Monica, California",41432,"John Zawahri, 23, armed with a homemade assault rifle and high-capacity magazines, killed his brother and father at home and then headed to Santa Monica College, where he was eventually killed by police.",6,3,9,"Other
",23,Yes,He was known as a solitary teen who regularly ditched class and had an interest in assault weapons; he had been admitted to UCLA's psychiatric ward for a brief period.,Yes,Assembled a rifle out of component parts.,"Assault rifle, high capacity magazines, antique handgun
",".223-caliber semi-automatic assault rifle, about 40 high capacity magazines, ""black powder"" handgun (likely antique)",White,Male,http://www.cbsnews.com/8301-504083_162-57589327-504083/john-zawahri-suspected-gunman-in-deadly-santa-monica-shooting-left-farewell-note-police-say/,"http://www.cbsnews.com/8301-504083_162-57589327-504083/john-zawahri-suspected-gunman-in-deadly-santa-monica-shooting-left-farewell-note-police-say/   http://www.latimes.com/news/local/la-me-0611-santa-monica-shooting-20130611,0,1490078.story",http://www.cbsnews.com/8301-504083_162-57589327-504083/john-zawahri-suspected-gunman-in-deadly-santa-monica-shooting-left-farewell-note-police-say/,34.008617,-118.494754,Mass,2013,"Santa Monica, California",10,California,High Umemployment,,Low Fatalities
Pinewood Village Apartment shooting,"Federal Way, Washington",41385,"Dennis Clark III, 27, shot and killed his girlfriend in their shared apartment, and then shot two witnesses in the building's parking lot and a third victim in another apartment, before being killed by police.",5,0,5,"Other
",27,No,-,Yes,Unknown,"Semiautomatic handgun, shotgun",".40 caliber semi-automatic handgun, pistol grip shotgun",Black,Male,http://seattletimes.com/html/localnews/2020836119_federalwayshootingxml.html,-,http://seattletimes.com/html/localnews/2020836119_federalwayshootingxml.html,47.3129607,-122.3393665,Mass,2013,"Federal Way, Washington",10,Washington,High Umemployment,,Low Fatalities
Mohawk Valley shootings,"Herkimer County, New York",41346,"Kurt Myers, 64, shot six people in neighboring towns, killing two in a barbershop and two at a car care business, before being killed by officers in a shootout after a nearly 19-hour standoff.",5,2,7,Other,64,No,-,Yes,"Frank's Guns in Marcy, NY",Shotgun,Unknown,White,Male,https://www.nyspnews.com/article_display.cfm?article_id=29584,http://poststar.com/news/local/state-and-regional/cops-kill-suspect-in-deadly-mohawk-valley-shooting-rampage/article_15260208-8bf5-11e2-b2d9-0019bb2963f4.html,https://www.nyspnews.com/article_display.cfm?article_id=29584,43.045601,-74.984891,Mass,2013,"Herkimer County, New York",8,New York,High Umemployment,,Low Fatalities
